import axios from "axios";
import { BASE, NOTIFICACIONES } from "env";
import {
  setNotificaciones,
  starLoadingNotificaciones,
} from "./notificacionesSlice";
import Cookies from "js-cookie";

export const getNotificaciones = (param) => {
  return async (dispatch) => {

    
    let notificacionesMock = [
        {
            "id": "181",
            "nombre": "notificaciones_05-19-2025-183700",
            "Desde": "2025-05-19",
            "Hasta": "2025-05-21",
            "Titulo": "notifica test 1",
            "mensaje_personalizado": "<p>test</p>",
            "creador_usuario_ldap": "CONSULTORA_ezense",
            "creacion_fecha": "2025-07-19 15:34:27",
            "estado": "inactivo",
            "ultimo_usuario_ldap": "CONSULTORA_ezense",
            "ultima_actualizacion": "2025-07-08 12:10:17",
            "titulo_interno": "notifica titulo interno",
            "id_Tabla": null,
            "archivos": {
                "imagen": {
                    "filename": "notif_img_2025_07_13_03_12_57_5909e8e9.png",
                    "url": "/portal/web/themes/iplan_b4/NEW/img/notificaciones/notif_img_2025_07_13_03_12_57_5909e8e9.png"
                },
                "csv_clientes": {
                    "filename": "notif_csv_clientes_2025_07_13_03_12_57_c575fe1c.csv",
                    "url": "/portal/web/comunicaciones/csv_files/notif_csv_clientes_2025_07_13_03_12_57_c575fe1c.csv"
                }
            }
        },
        {
            "id": "187",
            "nombre": "notificaciones_FINAL_07-09-2025-015656",
            "Desde": "2025-07-09",
            "Hasta": "2025-07-10",
            "Titulo": " 隆XITO TOTAL! - 2025-07-09 01:56:56",
            "mensaje_personalizado": "Sistema funcionando perfectamente",
            "creador_usuario_ldap": "SISTEMA_EXITOSO",
            "creacion_fecha": "2025-07-09 01:56:56",
            "estado": "activo",
            "ultimo_usuario_ldap": "SISTEMA_EXITOSO",
            "ultima_actualizacion": "2025-07-09 01:56:56",
            "titulo_interno": "EXITO_FINAL_07-09-2025-015656",
            "id_Tabla": null,
            "archivos": []
        },
        {
            "id": "186",
            "nombre": "notificaciones_FINAL_07-09-2025-015647",
            "Desde": "2025-07-09",
            "Hasta": "2025-07-10",
            "Titulo": " 隆XITO TOTAL! - 2025-07-09 01:56:47",
            "mensaje_personalizado": "Sistema funcionando perfectamente",
            "creador_usuario_ldap": "SISTEMA_EXITOSO",
            "creacion_fecha": "2025-07-09 01:56:47",
            "estado": "activo",
            "ultimo_usuario_ldap": "SISTEMA_EXITOSO",
            "ultima_actualizacion": "2025-07-09 01:56:47",
            "titulo_interno": "EXITO_FINAL_07-09-2025-015647",
            "id_Tabla": null,
            "archivos": []
        },
        {
            "id": "188",
            "nombre": "notificaciones_HOY_07-09-2025-023307",
            "Desde": "2025-07-08",
            "Hasta": "2025-07-09",
            "Titulo": " FUNCIONA HOY - 07-09-2025-023307",
            "mensaje_personalizado": "Esta notificaci贸n S debe funcionar hoy",
            "creador_usuario_ldap": "system_fix",
            "creacion_fecha": "2025-07-08 23:43:00",
            "estado": "activo",
            "ultimo_usuario_ldap": "system_fix",
            "ultima_actualizacion": "2025-07-08 23:43:00",
            "titulo_interno": "FUNCIONA_HOY",
            "id_Tabla": null,
            "archivos": []
        },
        {
            "id": "182",
            "nombre": "notificaciones_07-07-2025-201906",
            "Desde": "2025-07-06",
            "Hasta": "2025-07-26",
            "Titulo": "prueba borrar",
            "mensaje_personalizado": "<p>test</p>",
            "creador_usuario_ldap": "CONSULTORA_ezense",
            "creacion_fecha": "2025-07-07 17:18:18",
            "estado": "inactivo",
            "ultimo_usuario_ldap": "CONSULTORA_ezense",
            "ultima_actualizacion": "2025-07-08 12:10:14",
            "titulo_interno": "fwwe",
            "id_Tabla": null,
            "archivos": []
        },
        {
            "id": "180",
            "nombre": "notificaciones_01-21-2025-174223",
            "Desde": "2025-01-21",
            "Hasta": "2025-05-22",
            "Titulo": "Notificaci贸n Test 999",
            "mensaje_personalizado": "<p>Notificaci&oacute;n Test 999</p>",
            "creador_usuario_ldap": "CONSULTORA_ezense",
            "creacion_fecha": "2025-01-21 14:40:14",
            "estado": "activo",
            "ultimo_usuario_ldap": "CONSULTORA_ezense",
            "ultima_actualizacion": "2025-01-21 14:40:14",
            "titulo_interno": "Notificaci贸n Test 999",
            "id_Tabla": null,
            "archivos": []
        },
        {
            "id": "179",
            "nombre": "notificaciones_01-21-2025-174014",
            "Desde": "2025-01-21",
            "Hasta": "2025-01-22",
            "Titulo": "Notificaci贸n Test 99",
            "mensaje_personalizado": "<p>Notificaci&oacute;n Test 99</p>",
            "creador_usuario_ldap": "CONSULTORA_ezense",
            "creacion_fecha": "2025-01-21 14:39:01",
            "estado": "activo",
            "ultimo_usuario_ldap": "CONSULTORA_ezense",
            "ultima_actualizacion": "2025-01-21 14:39:01",
            "titulo_interno": "Notificaci贸n Test 99",
            "id_Tabla": null,
            "archivos": []
        },
        {
            "id": "178",
            "nombre": "notificaciones_01-21-2025-173901",
            "Desde": "2025-01-21",
            "Hasta": "2025-01-22",
            "Titulo": "noti 322",
            "mensaje_personalizado": "<p>noti 322</p>",
            "creador_usuario_ldap": "CONSULTORA_ezense",
            "creacion_fecha": "2025-01-21 14:37:19",
            "estado": "activo",
            "ultimo_usuario_ldap": "CONSULTORA_ezense",
            "ultima_actualizacion": "2025-01-21 14:37:19",
            "titulo_interno": "noti 322",
            "id_Tabla": null,
            "archivos": []
        },
        {
            "id": "177",
            "nombre": "notificaciones_01-21-2025-172929",
            "Desde": "2025-01-21",
            "Hasta": "2025-01-23",
            "Titulo": "test",
            "mensaje_personalizado": "<p>test</p>",
            "creador_usuario_ldap": "consultora_ezense",
            "creacion_fecha": "2025-01-21 14:26:45",
            "estado": "inactivo",
            "ultimo_usuario_ldap": "consultora_ezense",
            "ultima_actualizacion": "2025-01-21 14:29:52",
            "titulo_interno": "test",
            "id_Tabla": null,
            "archivos": []
        },
        {
            "id": "176",
            "nombre": "notificaciones_01-21-2025-172645",
            "Desde": "2025-01-21",
            "Hasta": "2025-01-23",
            "Titulo": "test6",
            "mensaje_personalizado": "<p>test6</p>",
            "creador_usuario_ldap": "consultora_ezense",
            "creacion_fecha": "2025-01-21 14:26:03",
            "estado": "inactivo",
            "ultimo_usuario_ldap": "consultora_ezense",
            "ultima_actualizacion": "2025-01-21 14:29:57",
            "titulo_interno": "test6",
            "id_Tabla": null,
            "archivos": []
        },
        {
            "id": "175",
            "nombre": "notificaciones_01-21-2025-171010",
            "Desde": "2025-01-21",
            "Hasta": "2025-01-22",
            "Titulo": "notificaci贸n",
            "mensaje_personalizado": "<p>notificaci&oacute;n</p>",
            "creador_usuario_ldap": "CONSULTORA_ezense",
            "creacion_fecha": "2025-01-21 14:09:31",
            "estado": "activo",
            "ultimo_usuario_ldap": "CONSULTORA_ezense",
            "ultima_actualizacion": "2025-01-21 14:09:31",
            "titulo_interno": "notificaci贸n",
            "id_Tabla": null,
            "archivos": []
        },
        {
            "id": "174",
            "nombre": "notificaciones_10-03-2024-131514",
            "Desde": "2024-10-03",
            "Hasta": "2024-10-04",
            "Titulo": "noti corta 2",
            "mensaje_personalizado": "<p>noti corta</p>",
            "creador_usuario_ldap": "CONSULTORA_ezense",
            "creacion_fecha": "2024-10-03 10:14:25",
            "estado": "activo",
            "ultimo_usuario_ldap": "CONSULTORA_ezense",
            "ultima_actualizacion": "2024-10-03 10:14:25",
            "titulo_interno": "noti corta 2",
            "id_Tabla": null,
            "archivos": []
        },
        {
            "id": "173",
            "nombre": "notificaciones_10-03-2024-131425",
            "Desde": "2024-10-03",
            "Hasta": "2024-10-04",
            "Titulo": "noti 2 - no aumento",
            "mensaje_personalizado": "<p><strong>Lorem Ipsum</strong> es simplemente el texto de relleno de las imprentas y archivos de texto. Lorem Ipsum ha sido el texto de relleno est&aacute;ndar de las industrias desde el a&ntilde;o 1500, cuando un impresor (N. del T. persona que se dedica a la imprenta) desconocido us&oacute; una galer&iacute;a de textos y los mezcl&oacute; de tal manera que logr&oacute; hacer un libro de textos especimen. No s&oacute;lo sobrevivi&oacute; 500 a&ntilde;os, sino que tambien ingres&oacute; como texto de relleno en documentos electr&oacute;nicos, quedando esencialmente igual al original. Fue popularizado en los 60s con la creaci&oacute;n de las hojas \"Letraset\", las cuales contenian pasajes de Lorem Ipsum, y m&aacute;s recientemente con software de autoedici&oacute;n, como por ejemplo Aldus PageMaker, el cual incluye versiones de Lorem Ipsum.</p>",
            "creador_usuario_ldap": "CONSULTORA_ezense",
            "creacion_fecha": "2024-10-03 10:13:31",
            "estado": "activo",
            "ultimo_usuario_ldap": "CONSULTORA_ezense",
            "ultima_actualizacion": "2024-10-03 10:13:31",
            "titulo_interno": "noti larga 2 - no aumento",
            "id_Tabla": null,
            "archivos": []
        },
        {
            "id": "172",
            "nombre": "notificaciones_10-03-2024-131331",
            "Desde": "2024-10-03",
            "Hasta": "2024-10-04",
            "Titulo": "noti corta 1 - no aumento",
            "mensaje_personalizado": "<p>texto corto</p><p><img src=\"../sites/default/files/2022-09/POWER_MESH_SITE-INIMACI%C3%93N.gif\" alt=\"\" width=\"501\" height=\"333\"></p>",
            "creador_usuario_ldap": "CONSULTORA_ezense",
            "creacion_fecha": "2024-10-03 10:12:53",
            "estado": "activo",
            "ultimo_usuario_ldap": "consultora_ezense",
            "ultima_actualizacion": "2024-10-03 10:15:08",
            "titulo_interno": "noti corta 1 - no aumento",
            "id_Tabla": null,
            "archivos": []
        },
        {
            "id": "171",
            "nombre": "notificaciones_10-03-2024-131253",
            "Desde": "2024-10-03",
            "Hasta": "2024-10-04",
            "Titulo": "noti larga 2",
            "mensaje_personalizado": "<p><strong>Lorem Ipsum</strong> es simplemente el texto de relleno de las imprentas y archivos de texto. Lorem Ipsum ha sido el texto de relleno est&aacute;ndar de las industrias desde el a&ntilde;o 1500, cuando un impresor (N. del T. persona que se dedica a la imprenta) desconocido us&oacute; una galer&iacute;a de textos y los mezcl&oacute; de tal manera que logr&oacute; hacer un libro de textos especimen. No s&oacute;lo sobrevivi&oacute; 500 a&ntilde;os, sino que tambien ingres&oacute; como texto de relleno en documentos electr&oacute;nicos, quedando esencialmente igual al original. Fue popularizado en los 60s con la creaci&oacute;n de las hojas \"Letraset\", las cuales contenian pasajes de Lorem Ipsum, y m&aacute;s recientemente con software de autoedici&oacute;n, como por ejemplo Aldus PageMaker, el cual incluye versiones de Lorem Ipsum.</p>",
            "creador_usuario_ldap": "CONSULTORA_ezense",
            "creacion_fecha": "2024-10-03 09:51:44",
            "estado": "activo",
            "ultimo_usuario_ldap": "CONSULTORA_ezense",
            "ultima_actualizacion": "2024-10-03 09:51:44",
            "titulo_interno": "noti larga 2",
            "id_Tabla": null,
            "archivos": []
        },
        {
            "id": "170",
            "nombre": "notificaciones_10-03-2024-125144",
            "Desde": "2024-10-03",
            "Hasta": "2024-10-04",
            "Titulo": "noti larga 1",
            "mensaje_personalizado": "<p><strong>Lorem Ipsum</strong> es simplemente el texto de relleno de las imprentas y archivos de texto. Lorem Ipsum ha sido el texto de relleno est&aacute;ndar de las industrias desde el a&ntilde;o 1500, cuando un impresor (N. del T. persona que se dedica a la imprenta) desconocido us&oacute; una galer&iacute;a de textos y los mezcl&oacute; de tal manera que logr&oacute; hacer un libro de textos especimen. No s&oacute;lo sobrevivi&oacute; 500 a&ntilde;os, sino que tambien ingres&oacute; como texto de relleno en documentos electr&oacute;nicos, quedando esencialmente igual al original. Fue popularizado en los 60s con la creaci&oacute;n de las hojas \"Letraset\", las cuales contenian pasajes de Lorem Ipsum, y m&aacute;s recientemente con software de autoedici&oacute;n, como por ejemplo Aldus PageMaker, el cual incluye versiones de Lorem Ipsum.</p>",
            "creador_usuario_ldap": "CONSULTORA_ezense",
            "creacion_fecha": "2024-10-03 09:47:58",
            "estado": "activo",
            "ultimo_usuario_ldap": "CONSULTORA_ezense",
            "ultima_actualizacion": "2024-10-03 09:47:58",
            "titulo_interno": "noti larga 1",
            "id_Tabla": null,
            "archivos": []
        },
        {
            "id": "169",
            "nombre": "notificaciones_10-01-2024-194348",
            "Desde": "2024-10-01",
            "Hasta": "2024-10-31",
            "Titulo": "test internal",
            "mensaje_personalizado": "<p>contenido de la notificacon y <span style=\"color: rgb(35, 111, 161);\"><a style=\"color: rgb(35, 111, 161);\" href=\"https://getbootstrap.com/docs/5.0/forms/checks-radios/\" target=\"_blank\" rel=\"noopener\">link</a></span><span style=\"color: rgb(0, 0, 0);\">&nbsp; yjuykukuyk&nbsp;&nbsp;</span></p>",
            "creador_usuario_ldap": "consultora_ezense",
            "creacion_fecha": "2024-10-01 16:42:39",
            "estado": "activo",
            "ultimo_usuario_ldap": "consultora_ezense",
            "ultima_actualizacion": "2024-10-01 16:59:15",
            "titulo_interno": "test internal",
            "id_Tabla": null,
            "archivos": []
        },
        {
            "id": "168",
            "nombre": "notificaciones_10-01-2024-192331",
            "Desde": "2024-09-28",
            "Hasta": "2024-10-10",
            "Titulo": "text example",
            "mensaje_personalizado": "<p>prueba interna</p>",
            "creador_usuario_ldap": "consultora_ezense",
            "creacion_fecha": "2024-10-01 16:22:30",
            "estado": "activo",
            "ultimo_usuario_ldap": "consultora_ezense",
            "ultima_actualizacion": "2024-10-01 16:22:30",
            "titulo_interno": "internal title",
            "id_Tabla": null,
            "archivos": []
        },
        {
            "id": "167",
            "nombre": "notificaciones_09-11-2024-183835",
            "Desde": "2024-09-11",
            "Hasta": "2024-10-03",
            "Titulo": "TEST 1",
            "mensaje_personalizado": "<p>TEST 1</p>",
            "creador_usuario_ldap": "CONSULTORA_ezense",
            "creacion_fecha": "2024-09-11 15:38:03",
            "estado": "activo",
            "ultimo_usuario_ldap": "CONSULTORA_ezense",
            "ultima_actualizacion": "2024-09-11 15:38:03",
            "titulo_interno": "TEST 1",
            "id_Tabla": null,
            "archivos": []
        },
        {
            "id": "166",
            "nombre": "notificaciones_09-11-2024-182157",
            "Desde": "2024-09-11",
            "Hasta": "2024-09-12",
            "Titulo": "test desarrollo 1",
            "mensaje_personalizado": "<p>test desarrollo 1</p>",
            "creador_usuario_ldap": "CONSULTORA_ezense",
            "creacion_fecha": "2024-09-11 15:21:14",
            "estado": "inactivo",
            "ultimo_usuario_ldap": "CONSULTORA_ezense",
            "ultima_actualizacion": "2024-09-11 15:24:42",
            "titulo_interno": "test desarrollo 1",
            "id_Tabla": null,
            "archivos": []
        },
        {
            "id": "165",
            "nombre": "notificaciones_09-11-2024-182114",
            "Desde": "2024-09-11",
            "Hasta": "2024-09-12",
            "Titulo": "test desarrollo 1",
            "mensaje_personalizado": "<p>test desarrollo 1</p>",
            "creador_usuario_ldap": "CONSULTORA_ezense",
            "creacion_fecha": "2024-09-11 15:20:15",
            "estado": "inactivo",
            "ultimo_usuario_ldap": "CONSULTORA_ezense",
            "ultima_actualizacion": "2024-09-11 15:24:36",
            "titulo_interno": "test desarrollo 1",
            "id_Tabla": null,
            "archivos": []
        },
        {
            "id": "164",
            "nombre": "notificaciones_09-11-2024-140312",
            "Desde": "2024-09-11",
            "Hasta": "2024-09-12",
            "Titulo": "TEST FINAL PROD 1",
            "mensaje_personalizado": "<p>TEST FINAL PROD 1</p>",
            "creador_usuario_ldap": "CONSULTORA_ezense",
            "creacion_fecha": "2024-09-11 11:02:03",
            "estado": "activo",
            "ultimo_usuario_ldap": "CONSULTORA_ezense",
            "ultima_actualizacion": "2024-09-11 11:02:03",
            "titulo_interno": "TEST FINAL PROD 1",
            "id_Tabla": null,
            "archivos": []
        },
        {
            "id": "163",
            "nombre": "notificaciones_08-30-2024-195541",
            "Desde": "2024-08-30",
            "Hasta": "2024-08-31",
            "Titulo": "Notificaci贸n 30-08 3",
            "mensaje_personalizado": "<p>Notificaci&oacute;n 30-08 3</p>",
            "creador_usuario_ldap": "CONSULTORA_ezense",
            "creacion_fecha": "2024-08-30 16:49:20",
            "estado": "activo",
            "ultimo_usuario_ldap": "CONSULTORA_ezense",
            "ultima_actualizacion": "2024-08-30 16:49:20",
            "titulo_interno": "Notificaci贸n 30-08 3",
            "id_Tabla": null,
            "archivos": []
        },
        {
            "id": "162",
            "nombre": "notificaciones_08-30-2024-194919",
            "Desde": "2024-08-30",
            "Hasta": "2024-08-31",
            "Titulo": "Notificaci贸n 30-08 2",
            "mensaje_personalizado": "<p>Notificaci&oacute;n 30-08 2</p>",
            "creador_usuario_ldap": "CONSULTORA_ezense",
            "creacion_fecha": "2024-08-30 16:48:55",
            "estado": "activo",
            "ultimo_usuario_ldap": "CONSULTORA_ezense",
            "ultima_actualizacion": "2024-08-30 16:48:55",
            "titulo_interno": "Notificaci贸n 30-08 2",
            "id_Tabla": null,
            "archivos": []
        },
        {
            "id": "161",
            "nombre": "notificaciones_08-30-2024-194855",
            "Desde": "2024-08-30",
            "Hasta": "2024-08-31",
            "Titulo": "Notificaci贸n 30-08 1",
            "mensaje_personalizado": "<p>Notificaci&oacute;n 30-08 1</p>",
            "creador_usuario_ldap": "CONSULTORA_ezense",
            "creacion_fecha": "2024-08-30 16:45:02",
            "estado": "activo",
            "ultimo_usuario_ldap": "CONSULTORA_ezense",
            "ultima_actualizacion": "2024-08-30 16:45:02",
            "titulo_interno": "Notificaci贸n 30-08 1",
            "id_Tabla": null,
            "archivos": []
        },
        {
            "id": "160",
            "nombre": "notificaciones_08-30-2024-183012",
            "Desde": "2024-08-30",
            "Hasta": "2024-08-31",
            "Titulo": "Notificaci贸n con acento 30-08",
            "mensaje_personalizado": "<p>Notificaci&oacute;n con acento 30-08</p>",
            "creador_usuario_ldap": "CONSULTORA_ezense",
            "creacion_fecha": "2024-08-30 15:24:36",
            "estado": "activo",
            "ultimo_usuario_ldap": "CONSULTORA_ezense",
            "ultima_actualizacion": "2024-08-30 15:24:36",
            "titulo_interno": "Notificaci贸n con acento 30-08",
            "id_Tabla": null,
            "archivos": []
        },
        {
            "id": "159",
            "nombre": "notificaciones_08-26-2024-173328",
            "Desde": "2024-08-26",
            "Hasta": "2024-08-27",
            "Titulo": "test desa 1",
            "mensaje_personalizado": "<p>test desa 1</p>",
            "creador_usuario_ldap": "CONSULTORA_ezense",
            "creacion_fecha": "2024-08-26 14:32:49",
            "estado": "activo",
            "ultimo_usuario_ldap": "CONSULTORA_ezense",
            "ultima_actualizacion": "2024-08-26 14:32:49",
            "titulo_interno": "test desa 1",
            "id_Tabla": null,
            "archivos": []
        },
        {
            "id": "158",
            "nombre": "notificaciones_08-26-2024-142556",
            "Desde": "2024-08-26",
            "Hasta": "2024-08-28",
            "Titulo": "test 26-8 2",
            "mensaje_personalizado": "<p>test 26-8 2</p>",
            "creador_usuario_ldap": "CONSULTORA_ezense",
            "creacion_fecha": "2024-08-26 11:25:32",
            "estado": "activo",
            "ultimo_usuario_ldap": "CONSULTORA_ezense",
            "ultima_actualizacion": "2024-08-26 11:25:32",
            "titulo_interno": "test 26-8 2",
            "id_Tabla": null,
            "archivos": []
        },
        {
            "id": "157",
            "nombre": "notificaciones_08-26-2024-142532",
            "Desde": "2024-08-26",
            "Hasta": "2024-08-27",
            "Titulo": "test 26-8 1",
            "mensaje_personalizado": "<p>test 26-8 1</p>",
            "creador_usuario_ldap": "CONSULTORA_ezense",
            "creacion_fecha": "2024-08-26 11:24:31",
            "estado": "activo",
            "ultimo_usuario_ldap": "CONSULTORA_ezense",
            "ultima_actualizacion": "2024-08-26 11:24:31",
            "titulo_interno": "test 26-8 1",
            "id_Tabla": null,
            "archivos": []
        },
        {
            "id": "156",
            "nombre": "notificaciones_08-23-2024-165935",
            "Desde": "2024-08-23",
            "Hasta": "2024-08-27",
            "Titulo": "test iplan residencial 5",
            "mensaje_personalizado": "<p>test iplan residencial 5</p>",
            "creador_usuario_ldap": "CONSULTORA_ezense",
            "creacion_fecha": "2024-08-23 13:59:13",
            "estado": "activo",
            "ultimo_usuario_ldap": "CONSULTORA_ezense",
            "ultima_actualizacion": "2024-08-23 13:59:13",
            "titulo_interno": "test iplan residencial 5",
            "id_Tabla": null,
            "archivos": []
        },
        {
            "id": "155",
            "nombre": "notificaciones_08-23-2024-165913",
            "Desde": "2024-08-23",
            "Hasta": "2024-08-27",
            "Titulo": "test iplan residencial 4",
            "mensaje_personalizado": "<p>test iplan residencial 4</p>",
            "creador_usuario_ldap": "CONSULTORA_ezense",
            "creacion_fecha": "2024-08-23 13:58:19",
            "estado": "activo",
            "ultimo_usuario_ldap": "CONSULTORA_ezense",
            "ultima_actualizacion": "2024-08-23 13:58:19",
            "titulo_interno": "test iplan residencial 4",
            "id_Tabla": null,
            "archivos": []
        },
        {
            "id": "154",
            "nombre": "notificaciones_08-23-2024-165814",
            "Desde": "2024-08-23",
            "Hasta": "2024-08-27",
            "Titulo": "test iplan residencial 3",
            "mensaje_personalizado": "<p>test iplan residencial 3</p>",
            "creador_usuario_ldap": "CONSULTORA_ezense",
            "creacion_fecha": "2024-08-23 12:52:14",
            "estado": "activo",
            "ultimo_usuario_ldap": "CONSULTORA_ezense",
            "ultima_actualizacion": "2024-08-23 12:52:14",
            "titulo_interno": "test iplan residencial 3",
            "id_Tabla": null,
            "archivos": []
        },
        {
            "id": "153",
            "nombre": "notificaciones_08-23-2024-155214",
            "Desde": "2024-08-23",
            "Hasta": "2024-08-27",
            "Titulo": "test iplan residencial 2",
            "mensaje_personalizado": "<p>test iplan residencial 2</p>",
            "creador_usuario_ldap": "CONSULTORA_ezense",
            "creacion_fecha": "2024-08-23 12:34:03",
            "estado": "activo",
            "ultimo_usuario_ldap": "CONSULTORA_ezense",
            "ultima_actualizacion": "2024-08-23 12:34:03",
            "titulo_interno": "test iplan residencial 2",
            "id_Tabla": null,
            "archivos": []
        },
        {
            "id": "152",
            "nombre": "notificaciones_08-23-2024-153403",
            "Desde": "2024-08-23",
            "Hasta": "2024-08-27",
            "Titulo": "test iplan residencial 1",
            "mensaje_personalizado": "<p>test iplan residencial 1</p>",
            "creador_usuario_ldap": "CONSULTORA_ezense",
            "creacion_fecha": "2024-08-23 12:32:53",
            "estado": "activo",
            "ultimo_usuario_ldap": "CONSULTORA_ezense",
            "ultima_actualizacion": "2024-08-23 12:32:53",
            "titulo_interno": "test iplan residencial 1",
            "id_Tabla": null,
            "archivos": []
        },
        {
            "id": "151",
            "nombre": "notificaciones_08-15-2024-185458",
            "Desde": "2024-08-15",
            "Hasta": "2024-08-18",
            "Titulo": "noti tarde 3",
            "mensaje_personalizado": "<p>noti tarde 3</p>",
            "creador_usuario_ldap": "CONSULTORA_ezense",
            "creacion_fecha": "2024-08-15 15:53:52",
            "estado": "activo",
            "ultimo_usuario_ldap": "CONSULTORA_ezense",
            "ultima_actualizacion": "2024-08-15 15:53:52",
            "titulo_interno": "noti tarde 3",
            "id_Tabla": null,
            "archivos": []
        },
        {
            "id": "150",
            "nombre": "notificaciones_08-15-2024-185352",
            "Desde": "2024-08-15",
            "Hasta": "2024-08-18",
            "Titulo": "noti tarde 2",
            "mensaje_personalizado": "<p>noti tarde 2</p>",
            "creador_usuario_ldap": "CONSULTORA_ezense",
            "creacion_fecha": "2024-08-15 15:53:25",
            "estado": "activo",
            "ultimo_usuario_ldap": "CONSULTORA_ezense",
            "ultima_actualizacion": "2024-08-15 15:53:25",
            "titulo_interno": "noti tarde 2",
            "id_Tabla": null,
            "archivos": []
        },
        {
            "id": "149",
            "nombre": "notificaciones_08-15-2024-185325",
            "Desde": "2024-08-15",
            "Hasta": "2024-08-18",
            "Titulo": "noti tarde 1",
            "mensaje_personalizado": "<p>noti tarde 1</p>",
            "creador_usuario_ldap": "CONSULTORA_ezense",
            "creacion_fecha": "2024-08-15 15:51:59",
            "estado": "activo",
            "ultimo_usuario_ldap": "CONSULTORA_ezense",
            "ultima_actualizacion": "2024-08-15 15:51:59",
            "titulo_interno": "noti tarde 1",
            "id_Tabla": null,
            "archivos": []
        },
        {
            "id": "148",
            "nombre": "notificaciones_08-15-2024-185159",
            "Desde": "2024-08-15",
            "Hasta": "2024-08-18",
            "Titulo": "Noti tarde 15 50 - 3",
            "mensaje_personalizado": "<p>Noti tarde 15 50 - 3</p>",
            "creador_usuario_ldap": "CONSULTORA_ezense",
            "creacion_fecha": "2024-08-15 15:51:39",
            "estado": "activo",
            "ultimo_usuario_ldap": "CONSULTORA_ezense",
            "ultima_actualizacion": "2024-08-15 15:51:39",
            "titulo_interno": "Noti tarde 15 50 - 3",
            "id_Tabla": null,
            "archivos": []
        },
        {
            "id": "147",
            "nombre": "notificaciones_08-15-2024-185139",
            "Desde": "2024-08-15",
            "Hasta": "2024-08-18",
            "Titulo": "Noti tarde 15 50 - 2",
            "mensaje_personalizado": "<p>Noti tarde 15 50 - 2</p>",
            "creador_usuario_ldap": "CONSULTORA_ezense",
            "creacion_fecha": "2024-08-15 15:51:20",
            "estado": "activo",
            "ultimo_usuario_ldap": "CONSULTORA_ezense",
            "ultima_actualizacion": "2024-08-15 15:51:20",
            "titulo_interno": "Noti tarde 15 50 - 2",
            "id_Tabla": null,
            "archivos": []
        },
        {
            "id": "146",
            "nombre": "notificaciones_08-15-2024-185119",
            "Desde": "2024-08-15",
            "Hasta": "2024-08-18",
            "Titulo": "Noti tarde 15 50 - 1",
            "mensaje_personalizado": "<p>Noti tarde 15 50 - 1</p>",
            "creador_usuario_ldap": "CONSULTORA_ezense",
            "creacion_fecha": "2024-08-15 15:50:49",
            "estado": "activo",
            "ultimo_usuario_ldap": "CONSULTORA_ezense",
            "ultima_actualizacion": "2024-08-15 15:50:49",
            "titulo_interno": "Noti tarde 15 50 - 1",
            "id_Tabla": null,
            "archivos": []
        },
        {
            "id": "145",
            "nombre": "notificaciones_08-15-2024-183411",
            "Desde": "2024-08-15",
            "Hasta": "2024-08-18",
            "Titulo": "noti viernes 4",
            "mensaje_personalizado": "<p>noti viernes 4</p>",
            "creador_usuario_ldap": "CONSULTORA_ezense",
            "creacion_fecha": "2024-08-15 15:33:41",
            "estado": "activo",
            "ultimo_usuario_ldap": "CONSULTORA_ezense",
            "ultima_actualizacion": "2024-08-15 15:33:41",
            "titulo_interno": "noti viernes 4",
            "id_Tabla": null,
            "archivos": []
        },
        {
            "id": "144",
            "nombre": "notificaciones_08-15-2024-183341",
            "Desde": "2024-08-15",
            "Hasta": "2024-08-18",
            "Titulo": "noti viernes 3",
            "mensaje_personalizado": "<p>noti viernes 3</p>",
            "creador_usuario_ldap": "CONSULTORA_ezense",
            "creacion_fecha": "2024-08-15 15:33:13",
            "estado": "activo",
            "ultimo_usuario_ldap": "CONSULTORA_ezense",
            "ultima_actualizacion": "2024-08-15 15:33:13",
            "titulo_interno": "noti viernes 3",
            "id_Tabla": null,
            "archivos": []
        },
        {
            "id": "143",
            "nombre": "notificaciones_08-15-2024-183313",
            "Desde": "2024-08-15",
            "Hasta": "2024-08-18",
            "Titulo": "noti viernes 2",
            "mensaje_personalizado": "<p>noti viernes 2</p>",
            "creador_usuario_ldap": "CONSULTORA_ezense",
            "creacion_fecha": "2024-08-15 15:32:51",
            "estado": "activo",
            "ultimo_usuario_ldap": "CONSULTORA_ezense",
            "ultima_actualizacion": "2024-08-15 15:32:51",
            "titulo_interno": "noti viernes 2",
            "id_Tabla": null,
            "archivos": []
        },
        {
            "id": "142",
            "nombre": "notificaciones_08-15-2024-183251",
            "Desde": "2024-08-15",
            "Hasta": "2024-08-18",
            "Titulo": "noti viernes 1",
            "mensaje_personalizado": "<p>noti viernes 1</p>",
            "creador_usuario_ldap": "CONSULTORA_ezense",
            "creacion_fecha": "2024-08-15 15:32:15",
            "estado": "activo",
            "ultimo_usuario_ldap": "CONSULTORA_ezense",
            "ultima_actualizacion": "2024-08-15 15:32:15",
            "titulo_interno": "noti viernes 1",
            "id_Tabla": null,
            "archivos": []
        },
        {
            "id": "141",
            "nombre": "notificaciones_08-15-2024-180904",
            "Desde": "2024-08-15",
            "Hasta": "2024-08-18",
            "Titulo": "noti tarde 15 00 - 3",
            "mensaje_personalizado": "<p>noti tarde 15 00 - 3</p>",
            "creador_usuario_ldap": "CONSULTORA_ezense",
            "creacion_fecha": "2024-08-15 15:08:43",
            "estado": "activo",
            "ultimo_usuario_ldap": "CONSULTORA_ezense",
            "ultima_actualizacion": "2024-08-15 15:08:43",
            "titulo_interno": "noti tarde 15 00 - 3",
            "id_Tabla": null,
            "archivos": []
        },
        {
            "id": "140",
            "nombre": "notificaciones_08-15-2024-180843",
            "Desde": "2024-08-15",
            "Hasta": "2024-08-18",
            "Titulo": "noti tarde 15 00 - 2",
            "mensaje_personalizado": "<p>noti tarde 15 00 - 2</p>",
            "creador_usuario_ldap": "CONSULTORA_ezense",
            "creacion_fecha": "2024-08-15 15:08:23",
            "estado": "activo",
            "ultimo_usuario_ldap": "CONSULTORA_ezense",
            "ultima_actualizacion": "2024-08-15 15:08:23",
            "titulo_interno": "noti tarde 15 00 - 2",
            "id_Tabla": null,
            "archivos": []
        },
        {
            "id": "139",
            "nombre": "notificaciones_08-15-2024-180818",
            "Desde": "2024-08-15",
            "Hasta": "2024-08-18",
            "Titulo": "noti tarde 15 00 - 1",
            "mensaje_personalizado": "<p>noti tarde 15 00 - 1</p>",
            "creador_usuario_ldap": "CONSULTORA_ezense",
            "creacion_fecha": "2024-08-15 14:40:18",
            "estado": "activo",
            "ultimo_usuario_ldap": "CONSULTORA_ezense",
            "ultima_actualizacion": "2024-08-15 14:40:18",
            "titulo_interno": "noti tarde 15 00 - 1",
            "id_Tabla": null,
            "archivos": []
        },
        {
            "id": "138",
            "nombre": "notificaciones_08-15-2024-174018",
            "Desde": "2024-08-15",
            "Hasta": "2024-08-18",
            "Titulo": "noti 15-08 4",
            "mensaje_personalizado": "<p>noti 15-08 4</p>",
            "creador_usuario_ldap": "CONSULTORA_ezense",
            "creacion_fecha": "2024-08-15 14:39:24",
            "estado": "activo",
            "ultimo_usuario_ldap": "CONSULTORA_ezense",
            "ultima_actualizacion": "2024-08-15 14:39:24",
            "titulo_interno": "noti 15-08 4",
            "id_Tabla": null,
            "archivos": []
        },
        {
            "id": "137",
            "nombre": "notificaciones_08-15-2024-173924",
            "Desde": "2024-08-15",
            "Hasta": "2024-08-18",
            "Titulo": "noti 15-08 3",
            "mensaje_personalizado": "<p>noti 15-08 3</p>",
            "creador_usuario_ldap": "CONSULTORA_ezense",
            "creacion_fecha": "2024-08-15 14:38:22",
            "estado": "activo",
            "ultimo_usuario_ldap": "CONSULTORA_ezense",
            "ultima_actualizacion": "2024-08-15 14:38:22",
            "titulo_interno": "noti 15-08 3",
            "id_Tabla": null,
            "archivos": []
        },
        {
            "id": "136",
            "nombre": "notificaciones_08-15-2024-173821",
            "Desde": "2024-08-15",
            "Hasta": "2024-08-18",
            "Titulo": "noti 15-08 2",
            "mensaje_personalizado": "<p>noti 15-08 2</p>",
            "creador_usuario_ldap": "CONSULTORA_ezense",
            "creacion_fecha": "2024-08-15 14:37:50",
            "estado": "activo",
            "ultimo_usuario_ldap": "CONSULTORA_ezense",
            "ultima_actualizacion": "2024-08-15 14:37:50",
            "titulo_interno": "noti 15-08 2",
            "id_Tabla": null,
            "archivos": []
        },
        {
            "id": "135",
            "nombre": "notificaciones_08-15-2024-173745",
            "Desde": "2024-08-15",
            "Hasta": "2024-08-18",
            "Titulo": "noti 15-08 1",
            "mensaje_personalizado": "<p>noti 15-08 1</p>",
            "creador_usuario_ldap": "CONSULTORA_ezense",
            "creacion_fecha": "2024-08-15 13:36:02",
            "estado": "activo",
            "ultimo_usuario_ldap": "CONSULTORA_ezense",
            "ultima_actualizacion": "2024-08-15 13:36:02",
            "titulo_interno": "noti 15-08 1",
            "id_Tabla": null,
            "archivos": []
        },
        {
            "id": "134",
            "nombre": "notificaciones_08-15-2024-163602",
            "Desde": "2024-08-15",
            "Hasta": "2024-08-17",
            "Titulo": "noti Nieto 2",
            "mensaje_personalizado": "<p>noti Nieto 2</p>",
            "creador_usuario_ldap": "CONSULTORA_ezense",
            "creacion_fecha": "2024-08-15 13:30:59",
            "estado": "activo",
            "ultimo_usuario_ldap": "CONSULTORA_ezense",
            "ultima_actualizacion": "2024-08-15 13:30:59",
            "titulo_interno": "noti Nieto 2",
            "id_Tabla": null,
            "archivos": []
        },
        {
            "id": "133",
            "nombre": "notificaciones_08-15-2024-163058",
            "Desde": "2024-08-15",
            "Hasta": "2024-08-17",
            "Titulo": "Notificaci贸n Nieto 1",
            "mensaje_personalizado": "<p>Notificaci&oacute;n Nieto 1</p>",
            "creador_usuario_ldap": "CONSULTORA_ezense",
            "creacion_fecha": "2024-08-15 13:29:55",
            "estado": "activo",
            "ultimo_usuario_ldap": "CONSULTORA_ezense",
            "ultima_actualizacion": "2024-08-15 13:29:55",
            "titulo_interno": "Notificaci贸n Nieto 1",
            "id_Tabla": null,
            "archivos": []
        },
        {
            "id": "132",
            "nombre": "notificaciones_08-15-2024-162955",
            "Desde": "2024-08-15",
            "Hasta": "2024-08-17",
            "Titulo": "Notificaci贸n Nieto 1",
            "mensaje_personalizado": "<p>Notificaci&oacute;n Nieto 1</p>",
            "creador_usuario_ldap": "CONSULTORA_ezense",
            "creacion_fecha": "2024-08-15 13:28:48",
            "estado": "activo",
            "ultimo_usuario_ldap": "CONSULTORA_ezense",
            "ultima_actualizacion": "2024-08-15 13:28:48",
            "titulo_interno": "Notificaci贸n Nieto 1",
            "id_Tabla": null,
            "archivos": []
        },
        {
            "id": "131",
            "nombre": "notificaciones_08-13-2024-161028",
            "Desde": "2024-08-13",
            "Hasta": "2024-08-14",
            "Titulo": "test tarde 6",
            "mensaje_personalizado": "<p>test tarde 6</p>",
            "creador_usuario_ldap": "CONSULTORA_ezense",
            "creacion_fecha": "2024-08-13 13:09:28",
            "estado": "activo",
            "ultimo_usuario_ldap": "CONSULTORA_ezense",
            "ultima_actualizacion": "2024-08-13 13:09:28",
            "titulo_interno": "test tarde 6",
            "id_Tabla": null,
            "archivos": []
        },
        {
            "id": "130",
            "nombre": "notificaciones_08-13-2024-160928",
            "Desde": "2024-08-13",
            "Hasta": "2024-08-14",
            "Titulo": "test tarde 5",
            "mensaje_personalizado": "<p>test tarde 5</p>",
            "creador_usuario_ldap": "CONSULTORA_ezense",
            "creacion_fecha": "2024-08-13 13:08:09",
            "estado": "activo",
            "ultimo_usuario_ldap": "CONSULTORA_ezense",
            "ultima_actualizacion": "2024-08-13 13:08:09",
            "titulo_interno": "test tarde 5",
            "id_Tabla": null,
            "archivos": []
        },
        {
            "id": "129",
            "nombre": "notificaciones_08-13-2024-160809",
            "Desde": "2024-08-13",
            "Hasta": "2024-08-14",
            "Titulo": "test tarde 3",
            "mensaje_personalizado": "<p>test tarde 3</p>",
            "creador_usuario_ldap": "CONSULTORA_ezense",
            "creacion_fecha": "2024-08-13 13:07:31",
            "estado": "activo",
            "ultimo_usuario_ldap": "CONSULTORA_ezense",
            "ultima_actualizacion": "2024-08-13 13:07:31",
            "titulo_interno": "test tarde 3",
            "id_Tabla": null,
            "archivos": []
        },
        {
            "id": "128",
            "nombre": "notificaciones_08-13-2024-160730",
            "Desde": "2024-08-13",
            "Hasta": "2024-08-14",
            "Titulo": "test tarde 2",
            "mensaje_personalizado": "<p>test tarde 2</p>",
            "creador_usuario_ldap": "CONSULTORA_ezense",
            "creacion_fecha": "2024-08-13 13:06:43",
            "estado": "activo",
            "ultimo_usuario_ldap": "CONSULTORA_ezense",
            "ultima_actualizacion": "2024-08-13 13:06:43",
            "titulo_interno": "test tarde 2",
            "id_Tabla": null,
            "archivos": []
        },
        {
            "id": "127",
            "nombre": "notificaciones_08-13-2024-160643",
            "Desde": "2024-08-13",
            "Hasta": "2024-08-14",
            "Titulo": "test tarde 1",
            "mensaje_personalizado": "<p>test tarde 1</p>",
            "creador_usuario_ldap": "CONSULTORA_ezense",
            "creacion_fecha": "2024-08-13 13:05:08",
            "estado": "activo",
            "ultimo_usuario_ldap": "CONSULTORA_ezense",
            "ultima_actualizacion": "2024-08-13 13:05:08",
            "titulo_interno": "test tarde 1",
            "id_Tabla": null,
            "archivos": []
        },
        {
            "id": "126",
            "nombre": "notificaciones_08-13-2024-121633",
            "Desde": "2024-08-13",
            "Hasta": "2024-08-14",
            "Titulo": "noti sin 00",
            "mensaje_personalizado": "<p>noti sin 00</p>",
            "creador_usuario_ldap": "CONSULTORA_ezense",
            "creacion_fecha": "2024-08-13 09:15:23",
            "estado": "activo",
            "ultimo_usuario_ldap": "CONSULTORA_ezense",
            "ultima_actualizacion": "2024-08-13 09:15:23",
            "titulo_interno": "noti sin 00",
            "id_Tabla": null,
            "archivos": []
        },
        {
            "id": "125",
            "nombre": "notificaciones_08-13-2024-121523",
            "Desde": "2024-08-13",
            "Hasta": "2024-08-14",
            "Titulo": "9 20",
            "mensaje_personalizado": "<p>9 20</p>",
            "creador_usuario_ldap": "CONSULTORA_ezense",
            "creacion_fecha": "2024-08-13 09:14:10",
            "estado": "activo",
            "ultimo_usuario_ldap": "CONSULTORA_ezense",
            "ultima_actualizacion": "2024-08-13 09:14:10",
            "titulo_interno": "9 20",
            "id_Tabla": null,
            "archivos": []
        },
        {
            "id": "124",
            "nombre": "notificaciones_08-13-2024-120918",
            "Desde": "2024-08-13",
            "Hasta": "2024-08-14",
            "Titulo": "test 9 15",
            "mensaje_personalizado": "<p>test 9 15</p>",
            "creador_usuario_ldap": "CONSULTORA_ezense",
            "creacion_fecha": "2024-08-13 09:05:06",
            "estado": "activo",
            "ultimo_usuario_ldap": "CONSULTORA_ezense",
            "ultima_actualizacion": "2024-08-13 09:05:06",
            "titulo_interno": "test 9 15",
            "id_Tabla": null,
            "archivos": []
        },
        {
            "id": "123",
            "nombre": "notificaciones_08-13-2024-120506",
            "Desde": "2024-08-13",
            "Hasta": "2024-08-14",
            "Titulo": "noti 9 13",
            "mensaje_personalizado": "<p>noti 9 13</p>",
            "creador_usuario_ldap": "CONSULTORA_ezense",
            "creacion_fecha": "2024-08-13 09:04:45",
            "estado": "activo",
            "ultimo_usuario_ldap": "CONSULTORA_ezense",
            "ultima_actualizacion": "2024-08-13 09:04:45",
            "titulo_interno": "noti 9 13",
            "id_Tabla": null,
            "archivos": []
        },
        {
            "id": "122",
            "nombre": "notificaciones_08-13-2024-120445",
            "Desde": "2024-08-13",
            "Hasta": "2024-08-14",
            "Titulo": "noti 9 12",
            "mensaje_personalizado": "<p>noti 9 12</p>",
            "creador_usuario_ldap": "CONSULTORA_ezense",
            "creacion_fecha": "2024-08-13 09:04:19",
            "estado": "activo",
            "ultimo_usuario_ldap": "CONSULTORA_ezense",
            "ultima_actualizacion": "2024-08-13 09:04:19",
            "titulo_interno": "noti 9 12",
            "id_Tabla": null,
            "archivos": []
        },
        {
            "id": "121",
            "nombre": "notificaciones_08-13-2024-120419",
            "Desde": "2024-08-13",
            "Hasta": "2024-08-14",
            "Titulo": "noti 9 11",
            "mensaje_personalizado": "<p>noti 9 11</p>",
            "creador_usuario_ldap": "CONSULTORA_ezense",
            "creacion_fecha": "2024-08-13 09:04:02",
            "estado": "activo",
            "ultimo_usuario_ldap": "CONSULTORA_ezense",
            "ultima_actualizacion": "2024-08-13 09:04:02",
            "titulo_interno": "noti 9 11",
            "id_Tabla": null,
            "archivos": []
        },
        {
            "id": "120",
            "nombre": "notificaciones_08-13-2024-120402",
            "Desde": "2024-08-13",
            "Hasta": "2024-08-14",
            "Titulo": "noti 9 10",
            "mensaje_personalizado": "<p>noti 9 10</p>",
            "creador_usuario_ldap": "CONSULTORA_ezense",
            "creacion_fecha": "2024-08-13 09:01:59",
            "estado": "activo",
            "ultimo_usuario_ldap": "CONSULTORA_ezense",
            "ultima_actualizacion": "2024-08-13 09:01:59",
            "titulo_interno": "noti 9 10",
            "id_Tabla": null,
            "archivos": []
        },
        {
            "id": "119",
            "nombre": "notificaciones_08-13-2024-120159",
            "Desde": "2024-08-13",
            "Hasta": "2024-08-14",
            "Titulo": "noti 9 05",
            "mensaje_personalizado": "<p>noti 9 05</p>",
            "creador_usuario_ldap": "CONSULTORA_ezense",
            "creacion_fecha": "2024-08-13 08:59:42",
            "estado": "activo",
            "ultimo_usuario_ldap": "CONSULTORA_ezense",
            "ultima_actualizacion": "2024-08-13 08:59:42",
            "titulo_interno": "noti 9 05",
            "id_Tabla": null,
            "archivos": []
        },
        {
            "id": "118",
            "nombre": "notificaciones_08-13-2024-115942",
            "Desde": "2024-08-13",
            "Hasta": "2024-08-14",
            "Titulo": "noti 08 58",
            "mensaje_personalizado": "<p>noti 08 58</p>",
            "creador_usuario_ldap": "CONSULTORA_ezense",
            "creacion_fecha": "2024-08-13 08:53:55",
            "estado": "activo",
            "ultimo_usuario_ldap": "CONSULTORA_ezense",
            "ultima_actualizacion": "2024-08-13 08:53:55",
            "titulo_interno": "noti 08 58",
            "id_Tabla": null,
            "archivos": []
        },
        {
            "id": "117",
            "nombre": "notificaciones_08-13-2024-115355",
            "Desde": "2024-08-13",
            "Hasta": "2024-08-14",
            "Titulo": "test 8 53",
            "mensaje_personalizado": "<p>test 8 53</p>",
            "creador_usuario_ldap": "CONSULTORA_ezense",
            "creacion_fecha": "2024-08-13 08:50:19",
            "estado": "activo",
            "ultimo_usuario_ldap": "CONSULTORA_ezense",
            "ultima_actualizacion": "2024-08-13 08:50:19",
            "titulo_interno": "test 8 53",
            "id_Tabla": null,
            "archivos": []
        },
        {
            "id": "116",
            "nombre": "notificaciones_08-13-2024-115019",
            "Desde": "2024-08-13",
            "Hasta": "2024-08-14",
            "Titulo": "test 9 00",
            "mensaje_personalizado": "<p>test 9 00</p>",
            "creador_usuario_ldap": "CONSULTORA_ezense",
            "creacion_fecha": "2024-08-13 08:50:02",
            "estado": "activo",
            "ultimo_usuario_ldap": "CONSULTORA_ezense",
            "ultima_actualizacion": "2024-08-13 08:50:02",
            "titulo_interno": "test 9 00",
            "id_Tabla": null,
            "archivos": []
        },
        {
            "id": "115",
            "nombre": "notificaciones_08-13-2024-114959",
            "Desde": "2024-08-13",
            "Hasta": "2024-08-14",
            "Titulo": "test 9 00",
            "mensaje_personalizado": "<p>test 9 00</p>",
            "creador_usuario_ldap": "CONSULTORA_ezense",
            "creacion_fecha": "2024-08-13 08:42:16",
            "estado": "activo",
            "ultimo_usuario_ldap": "CONSULTORA_ezense",
            "ultima_actualizacion": "2024-08-13 08:42:16",
            "titulo_interno": "test 9 00",
            "id_Tabla": null,
            "archivos": []
        },
        {
            "id": "114",
            "nombre": "notificaciones_08-13-2024-114216",
            "Desde": "2024-08-13",
            "Hasta": "2024-08-14",
            "Titulo": "test 8 50",
            "mensaje_personalizado": "<p>test &nbsp;8 50</p>",
            "creador_usuario_ldap": "CONSULTORA_ezense",
            "creacion_fecha": "2024-08-13 08:41:04",
            "estado": "activo",
            "ultimo_usuario_ldap": "CONSULTORA_ezense",
            "ultima_actualizacion": "2024-08-13 08:41:04",
            "titulo_interno": "test 8 50",
            "id_Tabla": null,
            "archivos": []
        },
        {
            "id": "113",
            "nombre": "notificaciones_08-13-2024-035327",
            "Desde": "2024-08-13",
            "Hasta": "2024-08-14",
            "Titulo": "Notificaci贸n Test 32",
            "mensaje_personalizado": "<p>Notificaci&oacute;n Test 32</p>",
            "creador_usuario_ldap": "CONSULTORA_ezense",
            "creacion_fecha": "2024-08-13 00:50:21",
            "estado": "activo",
            "ultimo_usuario_ldap": "CONSULTORA_ezense",
            "ultima_actualizacion": "2024-08-13 00:50:21",
            "titulo_interno": "Notificaci贸n Test 32",
            "id_Tabla": null,
            "archivos": []
        },
        {
            "id": "112",
            "nombre": "notificaciones_08-13-2024-035021",
            "Desde": "2024-08-13",
            "Hasta": "2024-08-14",
            "Titulo": "Notificaci贸n Test 31",
            "mensaje_personalizado": "<p>Notificaci&oacute;n Test 31</p>",
            "creador_usuario_ldap": "CONSULTORA_ezense",
            "creacion_fecha": "2024-08-13 00:50:01",
            "estado": "activo",
            "ultimo_usuario_ldap": "CONSULTORA_ezense",
            "ultima_actualizacion": "2024-08-13 00:50:01",
            "titulo_interno": "Notificaci贸n Test 31",
            "id_Tabla": null,
            "archivos": []
        },
        {
            "id": "111",
            "nombre": "notificaciones_08-13-2024-035000",
            "Desde": "2024-08-13",
            "Hasta": "2024-08-14",
            "Titulo": "Notificaci贸n Test 30",
            "mensaje_personalizado": "<p>Notificaci&oacute;n Test 30</p>",
            "creador_usuario_ldap": "CONSULTORA_ezense",
            "creacion_fecha": "2024-08-13 00:49:37",
            "estado": "activo",
            "ultimo_usuario_ldap": "CONSULTORA_ezense",
            "ultima_actualizacion": "2024-08-13 00:49:37",
            "titulo_interno": "Notificaci贸n Test 30",
            "id_Tabla": null,
            "archivos": []
        },
        {
            "id": "110",
            "nombre": "notificaciones_08-13-2024-034937",
            "Desde": "2024-08-13",
            "Hasta": "2024-08-14",
            "Titulo": "Notificaci贸n Test 9",
            "mensaje_personalizado": "<p>Notificaci&oacute;n Test 9</p>",
            "creador_usuario_ldap": "CONSULTORA_ezense",
            "creacion_fecha": "2024-08-13 00:47:40",
            "estado": "activo",
            "ultimo_usuario_ldap": "CONSULTORA_ezense",
            "ultima_actualizacion": "2024-08-13 00:47:40",
            "titulo_interno": "Notificaci贸n Test 9",
            "id_Tabla": null,
            "archivos": []
        },
        {
            "id": "109",
            "nombre": "notificaciones_08-13-2024-034740",
            "Desde": "2024-08-13",
            "Hasta": "2024-08-14",
            "Titulo": "Notificaci贸n Test 24",
            "mensaje_personalizado": "<p>Notificaci&oacute;n Test 24</p>",
            "creador_usuario_ldap": "CONSULTORA_ezense",
            "creacion_fecha": "2024-08-13 00:47:18",
            "estado": "activo",
            "ultimo_usuario_ldap": "CONSULTORA_ezense",
            "ultima_actualizacion": "2024-08-13 00:47:18",
            "titulo_interno": "Notificaci贸n Test 24",
            "id_Tabla": null,
            "archivos": []
        },
        {
            "id": "108",
            "nombre": "notificaciones_08-13-2024-034718",
            "Desde": "2024-08-13",
            "Hasta": "2024-08-14",
            "Titulo": "Notificaci贸n Test 22",
            "mensaje_personalizado": "<p>Notificaci&oacute;n Test 22</p>",
            "creador_usuario_ldap": "CONSULTORA_ezense",
            "creacion_fecha": "2024-08-13 00:46:54",
            "estado": "activo",
            "ultimo_usuario_ldap": "CONSULTORA_ezense",
            "ultima_actualizacion": "2024-08-13 00:46:54",
            "titulo_interno": "Notificaci贸n Test 22",
            "id_Tabla": null,
            "archivos": []
        },
        {
            "id": "107",
            "nombre": "notificaciones_08-13-2024-034654",
            "Desde": "2024-08-13",
            "Hasta": "2024-08-14",
            "Titulo": "Notificaci贸n Test 21",
            "mensaje_personalizado": "<p>Notificaci&oacute;n Test 21</p>",
            "creador_usuario_ldap": "CONSULTORA_ezense",
            "creacion_fecha": "2024-08-13 00:46:33",
            "estado": "activo",
            "ultimo_usuario_ldap": "CONSULTORA_ezense",
            "ultima_actualizacion": "2024-08-13 00:46:33",
            "titulo_interno": "Notificaci贸n Test 21",
            "id_Tabla": null,
            "archivos": []
        },
        {
            "id": "106",
            "nombre": "notificaciones_08-13-2024-034633",
            "Desde": "2024-08-13",
            "Hasta": "2024-08-14",
            "Titulo": "Notificaci贸n Test 20",
            "mensaje_personalizado": "<p>Notificaci&oacute;n Test 20</p>",
            "creador_usuario_ldap": "CONSULTORA_ezense",
            "creacion_fecha": "2024-08-13 00:36:44",
            "estado": "activo",
            "ultimo_usuario_ldap": "CONSULTORA_ezense",
            "ultima_actualizacion": "2024-08-13 00:36:44",
            "titulo_interno": "Notificaci贸n Test 20",
            "id_Tabla": null,
            "archivos": []
        },
        {
            "id": "105",
            "nombre": "notificaciones_08-13-2024-033644",
            "Desde": "2024-08-13",
            "Hasta": "2024-08-14",
            "Titulo": "noti makoto 10",
            "mensaje_personalizado": "<p>noti makoto 10</p>",
            "creador_usuario_ldap": "CONSULTORA_ezense",
            "creacion_fecha": "2024-08-13 00:34:56",
            "estado": "activo",
            "ultimo_usuario_ldap": "CONSULTORA_ezense",
            "ultima_actualizacion": "2024-08-13 00:34:56",
            "titulo_interno": "noti makoto 10",
            "id_Tabla": null,
            "archivos": []
        },
        {
            "id": "104",
            "nombre": "notificaciones_08-12-2024-134532",
            "Desde": "2024-08-12",
            "Hasta": "2024-08-13",
            "Titulo": "AIC WORLDWIDE LOGISTIC SA 2",
            "mensaje_personalizado": "<p>AIC WORLDWIDE LOGISTIC SA 2</p>",
            "creador_usuario_ldap": "CONSULTORA_ezense",
            "creacion_fecha": "2024-08-12 10:45:13",
            "estado": "activo",
            "ultimo_usuario_ldap": "CONSULTORA_ezense",
            "ultima_actualizacion": "2024-08-12 10:45:13",
            "titulo_interno": "AIC WORLDWIDE LOGISTIC SA 2",
            "id_Tabla": null,
            "archivos": []
        },
        {
            "id": "103",
            "nombre": "notificaciones_08-12-2024-134513",
            "Desde": "2024-08-12",
            "Hasta": "2024-08-13",
            "Titulo": "AIC WORLDWIDE LOGISTIC SA 1",
            "mensaje_personalizado": "<p>AIC WORLDWIDE LOGISTIC SA 1</p>",
            "creador_usuario_ldap": "CONSULTORA_ezense",
            "creacion_fecha": "2024-08-12 10:44:55",
            "estado": "activo",
            "ultimo_usuario_ldap": "CONSULTORA_ezense",
            "ultima_actualizacion": "2024-08-12 10:44:55",
            "titulo_interno": "AIC WORLDWIDE LOGISTIC SA 1",
            "id_Tabla": null,
            "archivos": []
        },
        {
            "id": "102",
            "nombre": "notificaciones_08-12-2024-134452",
            "Desde": "2024-08-12",
            "Hasta": "2024-08-13",
            "Titulo": "AIC WORLDWIDE LOGISTIC SA 1",
            "mensaje_personalizado": "<p>AIC WORLDWIDE LOGISTIC SA 1</p>",
            "creador_usuario_ldap": "CONSULTORA_ezense",
            "creacion_fecha": "2024-08-12 10:40:48",
            "estado": "activo",
            "ultimo_usuario_ldap": "CONSULTORA_ezense",
            "ultima_actualizacion": "2024-08-12 10:40:48",
            "titulo_interno": "AIC WORLDWIDE LOGISTIC SA 1",
            "id_Tabla": null,
            "archivos": []
        },
        {
            "id": "101",
            "nombre": "notificaciones_08-12-2024-134047",
            "Desde": "2024-08-12",
            "Hasta": "2024-08-13",
            "Titulo": "test ACCION POINT S.A 5",
            "mensaje_personalizado": "<p>test ACCION POINT S.A 5</p>",
            "creador_usuario_ldap": "CONSULTORA_ezense",
            "creacion_fecha": "2024-08-12 10:35:27",
            "estado": "activo",
            "ultimo_usuario_ldap": "CONSULTORA_ezense",
            "ultima_actualizacion": "2024-08-12 10:35:27",
            "titulo_interno": "test ACCION POINT S.A 5",
            "id_Tabla": null,
            "archivos": []
        },
        {
            "id": "100",
            "nombre": "notificaciones_08-12-2024-133526",
            "Desde": "2024-08-12",
            "Hasta": "2024-08-13",
            "Titulo": "test ACCION POINT S.A 4",
            "mensaje_personalizado": "<p>test ACCION POINT S.A 4</p>",
            "creador_usuario_ldap": "CONSULTORA_ezense",
            "creacion_fecha": "2024-08-12 10:34:56",
            "estado": "activo",
            "ultimo_usuario_ldap": "CONSULTORA_ezense",
            "ultima_actualizacion": "2024-08-12 10:34:56",
            "titulo_interno": "test ACCION POINT S.A 4",
            "id_Tabla": null,
            "archivos": []
        },
        {
            "id": "99",
            "nombre": "notificaciones_08-12-2024-133455",
            "Desde": "2024-08-12",
            "Hasta": "2024-08-13",
            "Titulo": "test ACCION POINT S.A 3",
            "mensaje_personalizado": "<p>test ACCION POINT S.A 3</p>",
            "creador_usuario_ldap": "CONSULTORA_ezense",
            "creacion_fecha": "2024-08-12 10:34:26",
            "estado": "activo",
            "ultimo_usuario_ldap": "CONSULTORA_ezense",
            "ultima_actualizacion": "2024-08-12 10:34:26",
            "titulo_interno": "test ACCION POINT S.A 3",
            "id_Tabla": null,
            "archivos": []
        },
        {
            "id": "98",
            "nombre": "notificaciones_08-12-2024-133426",
            "Desde": "2024-08-12",
            "Hasta": "2024-08-13",
            "Titulo": "test ACCION POINT S.A 2",
            "mensaje_personalizado": "<p>test ACCION POINT S.A 2</p>",
            "creador_usuario_ldap": "CONSULTORA_ezense",
            "creacion_fecha": "2024-08-12 10:34:05",
            "estado": "activo",
            "ultimo_usuario_ldap": "CONSULTORA_ezense",
            "ultima_actualizacion": "2024-08-12 10:34:05",
            "titulo_interno": "test ACCION POINT S.A 2",
            "id_Tabla": null,
            "archivos": []
        },
        {
            "id": "97",
            "nombre": "notificaciones_08-12-2024-133402",
            "Desde": "2024-08-12",
            "Hasta": "2024-08-13",
            "Titulo": "test ACCION POINT S.A 2",
            "mensaje_personalizado": "<p>test ACCION POINT S.A 2</p>",
            "creador_usuario_ldap": "CONSULTORA_ezense",
            "creacion_fecha": "2024-08-12 10:31:22",
            "estado": "activo",
            "ultimo_usuario_ldap": "CONSULTORA_ezense",
            "ultima_actualizacion": "2024-08-12 10:31:22",
            "titulo_interno": "test ACCION POINT S.A 1",
            "id_Tabla": null,
            "archivos": []
        },
        {
            "id": "96",
            "nombre": "notificaciones_08-12-2024-133122",
            "Desde": "2024-08-12",
            "Hasta": "2024-08-13",
            "Titulo": "noti makoto 2",
            "mensaje_personalizado": "<p>noti makoto 2</p>",
            "creador_usuario_ldap": "CONSULTORA_ezense",
            "creacion_fecha": "2024-08-12 10:30:57",
            "estado": "activo",
            "ultimo_usuario_ldap": "CONSULTORA_ezense",
            "ultima_actualizacion": "2024-08-12 10:30:57",
            "titulo_interno": "noti makoto 2",
            "id_Tabla": null,
            "archivos": []
        },
        {
            "id": "95",
            "nombre": "notificaciones_08-12-2024-133057",
            "Desde": "2024-08-12",
            "Hasta": "2024-08-13",
            "Titulo": "noti makoto 1",
            "mensaje_personalizado": "<p>noti makoto 1</p>",
            "creador_usuario_ldap": "CONSULTORA_ezense",
            "creacion_fecha": "2024-08-12 10:30:38",
            "estado": "activo",
            "ultimo_usuario_ldap": "CONSULTORA_ezense",
            "ultima_actualizacion": "2024-08-12 10:30:38",
            "titulo_interno": "noti makoto 1",
            "id_Tabla": null,
            "archivos": []
        },
        {
            "id": "94",
            "nombre": "notificaciones_08-12-2024-133035",
            "Desde": "2024-08-12",
            "Hasta": "2024-08-13",
            "Titulo": "noti makoto 1",
            "mensaje_personalizado": "<p>noti makoto 1</p>",
            "creador_usuario_ldap": "CONSULTORA_ezense",
            "creacion_fecha": "2024-08-12 10:19:26",
            "estado": "activo",
            "ultimo_usuario_ldap": "CONSULTORA_ezense",
            "ultima_actualizacion": "2024-08-12 10:19:26",
            "titulo_interno": "noti makoto 1",
            "id_Tabla": null,
            "archivos": []
        },
        {
            "id": "93",
            "nombre": "notificaciones_08-09-2024-140601",
            "Desde": "2024-08-09",
            "Hasta": "2024-08-10",
            "Titulo": "test 10",
            "mensaje_personalizado": "<p>test 10</p>",
            "creador_usuario_ldap": "CONSULTORA_ezense",
            "creacion_fecha": "2024-08-09 11:05:03",
            "estado": "activo",
            "ultimo_usuario_ldap": "CONSULTORA_ezense",
            "ultima_actualizacion": "2024-08-09 11:05:03",
            "titulo_interno": "test 10",
            "id_Tabla": null,
            "archivos": []
        },
        {
            "id": "92",
            "nombre": "notificaciones_08-09-2024-132027",
            "Desde": "2024-08-09",
            "Hasta": "2024-08-10",
            "Titulo": "test ofi",
            "mensaje_personalizado": "<p>test ofi</p>",
            "creador_usuario_ldap": "CONSULTORA_ezense",
            "creacion_fecha": "2024-08-09 10:20:01",
            "estado": "activo",
            "ultimo_usuario_ldap": "CONSULTORA_ezense",
            "ultima_actualizacion": "2024-08-09 10:20:01",
            "titulo_interno": "test ofi",
            "id_Tabla": null,
            "archivos": []
        },
        {
            "id": "91",
            "nombre": "notificaciones_08-09-2024-031749",
            "Desde": "2024-08-09",
            "Hasta": "2024-08-10",
            "Titulo": "test makoto 4",
            "mensaje_personalizado": "<p>test makoto 4</p>",
            "creador_usuario_ldap": "CONSULTORA_ezense",
            "creacion_fecha": "2024-08-09 00:17:29",
            "estado": "activo",
            "ultimo_usuario_ldap": "CONSULTORA_ezense",
            "ultima_actualizacion": "2024-08-09 00:17:29",
            "titulo_interno": "test makoto 4",
            "id_Tabla": null,
            "archivos": []
        },
        {
            "id": "90",
            "nombre": "notificaciones_08-09-2024-031729",
            "Desde": "2024-08-09",
            "Hasta": "2024-08-10",
            "Titulo": "test makoto 3",
            "mensaje_personalizado": "<p>test makoto 3</p>",
            "creador_usuario_ldap": "CONSULTORA_ezense",
            "creacion_fecha": "2024-08-09 00:17:08",
            "estado": "activo",
            "ultimo_usuario_ldap": "CONSULTORA_ezense",
            "ultima_actualizacion": "2024-08-09 00:17:08",
            "titulo_interno": "test makoto 3",
            "id_Tabla": null,
            "archivos": []
        },
        {
            "id": "89",
            "nombre": "notificaciones_08-09-2024-031708",
            "Desde": "2024-08-09",
            "Hasta": "2024-08-10",
            "Titulo": "test makoto 2",
            "mensaje_personalizado": "<p>test makoto 2</p>",
            "creador_usuario_ldap": "CONSULTORA_ezense",
            "creacion_fecha": "2024-08-09 00:16:44",
            "estado": "activo",
            "ultimo_usuario_ldap": "CONSULTORA_ezense",
            "ultima_actualizacion": "2024-08-09 00:16:44",
            "titulo_interno": "test makoto 2",
            "id_Tabla": null,
            "archivos": []
        },
        {
            "id": "88",
            "nombre": "notificaciones_08-09-2024-031644",
            "Desde": "2024-08-09",
            "Hasta": "2024-08-10",
            "Titulo": "test makoto 1",
            "mensaje_personalizado": "<p>test makoto 1</p>",
            "creador_usuario_ldap": "CONSULTORA_ezense",
            "creacion_fecha": "2024-08-09 00:16:22",
            "estado": "activo",
            "ultimo_usuario_ldap": "CONSULTORA_ezense",
            "ultima_actualizacion": "2024-08-09 00:16:22",
            "titulo_interno": "test makoto 1",
            "id_Tabla": null,
            "archivos": []
        },
        {
            "id": "87",
            "nombre": "notificaciones_08-09-2024-031618",
            "Desde": "2024-08-09",
            "Hasta": "2024-08-10",
            "Titulo": "test makoto 1",
            "mensaje_personalizado": "<p>test makoto 1</p>",
            "creador_usuario_ldap": "CONSULTORA_ezense",
            "creacion_fecha": "2024-08-09 00:05:08",
            "estado": "activo",
            "ultimo_usuario_ldap": "CONSULTORA_ezense",
            "ultima_actualizacion": "2024-08-09 00:05:08",
            "titulo_interno": "test makoto 1",
            "id_Tabla": null,
            "archivos": []
        },
        {
            "id": "86",
            "nombre": "notificaciones_08-09-2024-030508",
            "Desde": "2024-08-09",
            "Hasta": "2024-08-10",
            "Titulo": "test cef 2",
            "mensaje_personalizado": "<p>test cef 2</p>",
            "creador_usuario_ldap": "CONSULTORA_ezense",
            "creacion_fecha": "2024-08-08 23:58:17",
            "estado": "activo",
            "ultimo_usuario_ldap": "CONSULTORA_ezense",
            "ultima_actualizacion": "2024-08-08 23:58:17",
            "titulo_interno": "test cef 2",
            "id_Tabla": null,
            "archivos": []
        },
        {
            "id": "85",
            "nombre": "notificaciones_08-09-2024-025817",
            "Desde": "2024-08-08",
            "Hasta": "2024-08-09",
            "Titulo": "test cef",
            "mensaje_personalizado": "<p>test cef</p>",
            "creador_usuario_ldap": "CONSULTORA_ezense",
            "creacion_fecha": "2024-08-08 23:56:05",
            "estado": "activo",
            "ultimo_usuario_ldap": "CONSULTORA_ezense",
            "ultima_actualizacion": "2024-08-08 23:56:05",
            "titulo_interno": "test cef",
            "id_Tabla": null,
            "archivos": []
        },
        {
            "id": "84",
            "nombre": "notificaciones_08-08-2024-190653",
            "Desde": "2024-08-08",
            "Hasta": "2024-08-09",
            "Titulo": "test de aumento",
            "mensaje_personalizado": "<p>test de aumento</p>",
            "creador_usuario_ldap": "CONSULTORA_ezense",
            "creacion_fecha": "2024-08-08 15:11:58",
            "estado": "activo",
            "ultimo_usuario_ldap": "CONSULTORA_ezense",
            "ultima_actualizacion": "2024-08-08 15:11:58",
            "titulo_interno": "test de aumento",
            "id_Tabla": null,
            "archivos": []
        },
        {
            "id": "83",
            "nombre": "notificaciones_08-08-2024-181158",
            "Desde": "2024-08-08",
            "Hasta": "2024-08-09",
            "Titulo": "test con eric",
            "mensaje_personalizado": "<p>test con eric</p>",
            "creador_usuario_ldap": "CONSULTORA_ezense",
            "creacion_fecha": "2024-08-08 15:10:41",
            "estado": "activo",
            "ultimo_usuario_ldap": "CONSULTORA_ezense",
            "ultima_actualizacion": "2024-08-08 15:10:41",
            "titulo_interno": "test con eric",
            "id_Tabla": null,
            "archivos": []
        },
        {
            "id": "82",
            "nombre": "notificaciones_08-08-2024-181041",
            "Desde": "2024-08-08",
            "Hasta": "2024-08-09",
            "Titulo": "test con eric",
            "mensaje_personalizado": "<p>test con eric</p>",
            "creador_usuario_ldap": "CONSULTORA_ezense",
            "creacion_fecha": "2024-08-08 15:08:54",
            "estado": "activo",
            "ultimo_usuario_ldap": "CONSULTORA_ezense",
            "ultima_actualizacion": "2024-08-08 15:08:54",
            "titulo_interno": "Test con Eric",
            "id_Tabla": null,
            "archivos": []
        },
        {
            "id": "81",
            "nombre": "notificaciones_08-08-2024-180854",
            "Desde": "2024-08-08",
            "Hasta": "2024-08-10",
            "Titulo": "Test con Eric",
            "mensaje_personalizado": "<p>test co neric</p>",
            "creador_usuario_ldap": "CONSULTORA_ezense",
            "creacion_fecha": "2024-08-08 15:07:28",
            "estado": "activo",
            "ultimo_usuario_ldap": "CONSULTORA_ezense",
            "ultima_actualizacion": "2024-08-08 15:07:28",
            "titulo_interno": "Test con Eric",
            "id_Tabla": null,
            "archivos": []
        },
        {
            "id": "80",
            "nombre": "notificaciones_08-08-2024-180728",
            "Desde": "2024-08-08",
            "Hasta": "2024-08-09",
            "Titulo": "test con Eric",
            "mensaje_personalizado": "<p>test con Eric</p>",
            "creador_usuario_ldap": "CONSULTORA_ezense",
            "creacion_fecha": "2024-08-08 15:00:16",
            "estado": "activo",
            "ultimo_usuario_ldap": "CONSULTORA_ezense",
            "ultima_actualizacion": "2024-08-08 15:00:16",
            "titulo_interno": "Test con Eric",
            "id_Tabla": null,
            "archivos": []
        },
        {
            "id": "79",
            "nombre": "notificaciones_07-30-2024-180341",
            "Desde": "2024-07-30",
            "Hasta": "2024-08-30",
            "Titulo": "Notificaci贸n Test 9",
            "mensaje_personalizado": "<p>Notificaci&oacute;n Test 9</p>",
            "creador_usuario_ldap": "CONSULTORA_ezense",
            "creacion_fecha": "2024-07-30 15:01:18",
            "estado": "activo",
            "ultimo_usuario_ldap": "CONSULTORA_ezense",
            "ultima_actualizacion": "2024-07-30 15:01:18",
            "titulo_interno": "Notificaci贸n Test 9",
            "id_Tabla": null,
            "archivos": []
        },
        {
            "id": "78",
            "nombre": "notificaciones_07-30-2024-180118",
            "Desde": "2024-07-30",
            "Hasta": "2024-07-31",
            "Titulo": "Notificaci贸n Test 9",
            "mensaje_personalizado": "<p>Notificaci&oacute;n Test 9</p>",
            "creador_usuario_ldap": "CONSULTORA_ezense",
            "creacion_fecha": "2024-07-30 14:59:08",
            "estado": "activo",
            "ultimo_usuario_ldap": "CONSULTORA_ezense",
            "ultima_actualizacion": "2024-07-30 14:59:08",
            "titulo_interno": "Notificaci贸n Test 9",
            "id_Tabla": null,
            "archivos": []
        },
        {
            "id": "77",
            "nombre": "notificaciones_07-30-2024-175908",
            "Desde": "2024-07-30",
            "Hasta": "2024-07-31",
            "Titulo": "Notificaci贸n Test 9",
            "mensaje_personalizado": "<p>Noti test</p>",
            "creador_usuario_ldap": "CONSULTORA_ezense",
            "creacion_fecha": "2024-07-30 14:58:33",
            "estado": "activo",
            "ultimo_usuario_ldap": "CONSULTORA_ezense",
            "ultima_actualizacion": "2024-07-30 14:58:33",
            "titulo_interno": "Notificaci贸n Test 9",
            "id_Tabla": null,
            "archivos": []
        },
        {
            "id": "76",
            "nombre": "notificaciones_07-30-2024-171540",
            "Desde": "2024-07-30",
            "Hasta": "2024-07-31",
            "Titulo": "Notificaci贸n Test 99",
            "mensaje_personalizado": "<p>Si todo est&aacute; bien, av&iacute;same y lo pasamos en el Trello de desarrollo para que lo revise Juancho.</p>",
            "creador_usuario_ldap": "CONSULTORA_ezense",
            "creacion_fecha": "2024-07-30 14:15:16",
            "estado": "activo",
            "ultimo_usuario_ldap": "CONSULTORA_ezense",
            "ultima_actualizacion": "2024-07-30 14:15:16",
            "titulo_interno": "Notificaci贸n Test 99",
            "id_Tabla": null,
            "archivos": []
        },
        {
            "id": "75",
            "nombre": "notificaciones_07-30-2024-171516",
            "Desde": "2024-07-30",
            "Hasta": "2024-07-31",
            "Titulo": "Notificaci贸n Test 56",
            "mensaje_personalizado": "<p>Si todo est&aacute; bien, av&iacute;same y lo pasamos en el Trello de desarrollo para que lo revise Juancho.</p>",
            "creador_usuario_ldap": "CONSULTORA_ezense",
            "creacion_fecha": "2024-07-30 14:14:21",
            "estado": "activo",
            "ultimo_usuario_ldap": "CONSULTORA_ezense",
            "ultima_actualizacion": "2024-07-30 14:14:21",
            "titulo_interno": "Notificaci贸n Test 56",
            "id_Tabla": null,
            "archivos": []
        },
        {
            "id": "74",
            "nombre": "notificaciones_07-30-2024-171421",
            "Desde": "2024-07-30",
            "Hasta": "2024-07-30",
            "Titulo": "Notificaci贸n Test 10",
            "mensaje_personalizado": "<p>Si todo est&aacute; bien, av&iacute;same y lo pasamos en el Trello de desarrollo para que lo revise Juancho.</p>",
            "creador_usuario_ldap": "CONSULTORA_ezense",
            "creacion_fecha": "2024-07-30 14:13:49",
            "estado": "activo",
            "ultimo_usuario_ldap": "CONSULTORA_ezense",
            "ultima_actualizacion": "2024-07-30 14:13:49",
            "titulo_interno": "Notificaci贸n Test 10",
            "id_Tabla": null,
            "archivos": []
        },
        {
            "id": "73",
            "nombre": "notificaciones_07-30-2024-171349",
            "Desde": "2024-07-30",
            "Hasta": "2024-07-31",
            "Titulo": "Notificaci贸n Test 9",
            "mensaje_personalizado": "<p>Si todo est&aacute; bien, av&iacute;same y lo pasamos en el Trello de desarrollo para que lo revise Juancho.</p>",
            "creador_usuario_ldap": "CONSULTORA_ezense",
            "creacion_fecha": "2024-07-30 14:09:42",
            "estado": "activo",
            "ultimo_usuario_ldap": "CONSULTORA_ezense",
            "ultima_actualizacion": "2024-07-30 14:09:42",
            "titulo_interno": "Notificaci贸n Test 9",
            "id_Tabla": null,
            "archivos": []
        },
        {
            "id": "72",
            "nombre": "notificaciones_07-30-2024-170942",
            "Desde": "2024-07-30",
            "Hasta": "2024-07-31",
            "Titulo": "Notificaci贸n Test 9",
            "mensaje_personalizado": "<p>Notificaci&oacute;n Test 9</p>",
            "creador_usuario_ldap": "CONSULTORA_ezense",
            "creacion_fecha": "2024-07-30 13:57:24",
            "estado": "activo",
            "ultimo_usuario_ldap": "CONSULTORA_ezense",
            "ultima_actualizacion": "2024-07-30 13:57:24",
            "titulo_interno": "Notificaci贸n Test 9",
            "id_Tabla": null,
            "archivos": []
        },
        {
            "id": "71",
            "nombre": "notificaciones_07-30-2024-165724",
            "Desde": "2024-07-30",
            "Hasta": "2024-07-31",
            "Titulo": "Notificaci贸n Test 8",
            "mensaje_personalizado": "<p>Notificaci&oacute;n Test 8</p>",
            "creador_usuario_ldap": "CONSULTORA_ezense",
            "creacion_fecha": "2024-07-30 13:56:49",
            "estado": "activo",
            "ultimo_usuario_ldap": "CONSULTORA_ezense",
            "ultima_actualizacion": "2024-07-30 13:56:49",
            "titulo_interno": "Notificaci贸n Test 8",
            "id_Tabla": null,
            "archivos": []
        },
        {
            "id": "70",
            "nombre": "notificaciones_07-30-2024-165648",
            "Desde": "2024-07-30",
            "Hasta": "2024-07-31",
            "Titulo": "Notificaci贸n Test 7",
            "mensaje_personalizado": "<p>Notificaci&oacute;n Test 7</p>",
            "creador_usuario_ldap": "CONSULTORA_ezense",
            "creacion_fecha": "2024-07-30 13:55:15",
            "estado": "activo",
            "ultimo_usuario_ldap": "CONSULTORA_ezense",
            "ultima_actualizacion": "2024-07-30 13:55:15",
            "titulo_interno": "Notificaci贸n Test 7",
            "id_Tabla": null,
            "archivos": []
        },
        {
            "id": "69",
            "nombre": "notificaciones_07-30-2024-165515",
            "Desde": "2024-07-30",
            "Hasta": "2024-07-31",
            "Titulo": "Notificaci贸n Test 6",
            "mensaje_personalizado": "<p>Notificaci&oacute;n Test 6</p>",
            "creador_usuario_ldap": "CONSULTORA_ezense",
            "creacion_fecha": "2024-07-30 13:54:49",
            "estado": "activo",
            "ultimo_usuario_ldap": "CONSULTORA_ezense",
            "ultima_actualizacion": "2024-07-30 13:54:49",
            "titulo_interno": "Notificaci贸n Test 6",
            "id_Tabla": null,
            "archivos": []
        },
        {
            "id": "68",
            "nombre": "notificaciones_07-30-2024-154242",
            "Desde": "2024-07-30",
            "Hasta": "2024-08-01",
            "Titulo": "Notificaci贸n Test 5",
            "mensaje_personalizado": "<p>Notificaci&oacute;n Test 5</p>",
            "creador_usuario_ldap": "CONSULTORA_ezense",
            "creacion_fecha": "2024-07-30 12:42:00",
            "estado": "activo",
            "ultimo_usuario_ldap": "CONSULTORA_ezense",
            "ultima_actualizacion": "2024-07-30 12:42:00",
            "titulo_interno": "Notificaci贸n Test 5",
            "id_Tabla": null,
            "archivos": []
        },
        {
            "id": "67",
            "nombre": "notificaciones_07-30-2024-154156",
            "Desde": "2024-07-30",
            "Hasta": "2024-08-01",
            "Titulo": "Notificaci贸n Test 4",
            "mensaje_personalizado": "<p>Notificaci&oacute;n Test 4</p>",
            "creador_usuario_ldap": "CONSULTORA_ezense",
            "creacion_fecha": "2024-07-30 12:17:39",
            "estado": "activo",
            "ultimo_usuario_ldap": "CONSULTORA_ezense",
            "ultima_actualizacion": "2024-07-30 12:17:39",
            "titulo_interno": "Notificaci贸n Test 4",
            "id_Tabla": null,
            "archivos": []
        },
        {
            "id": "66",
            "nombre": "notificaciones_07-30-2024-151739",
            "Desde": "2024-07-30",
            "Hasta": "2024-08-01",
            "Titulo": "nueva noti",
            "mensaje_personalizado": "<p>esto es un test</p>",
            "creador_usuario_ldap": "CONSULTORA_ezense",
            "creacion_fecha": "2024-07-30 11:56:42",
            "estado": "activo",
            "ultimo_usuario_ldap": "CONSULTORA_ezense",
            "ultima_actualizacion": "2024-07-30 11:56:42",
            "titulo_interno": "nueva noti",
            "id_Tabla": null,
            "archivos": []
        },
        {
            "id": "65",
            "nombre": "notificaciones_07-30-2024-145642",
            "Desde": "2024-07-30",
            "Hasta": "2024-07-31",
            "Titulo": "Notificaci贸n Test",
            "mensaje_personalizado": "<p>Esto es un test</p>",
            "creador_usuario_ldap": "CONSULTORA_ezense",
            "creacion_fecha": "2024-07-30 11:56:00",
            "estado": "activo",
            "ultimo_usuario_ldap": "CONSULTORA_ezense",
            "ultima_actualizacion": "2024-07-30 11:56:00",
            "titulo_interno": "Notificaci贸n Test",
            "id_Tabla": null,
            "archivos": []
        },
        {
            "id": "64",
            "nombre": "notificaciones_07-30-2024-145555",
            "Desde": "2024-07-30",
            "Hasta": "2024-07-31",
            "Titulo": "Notificaci贸n Test",
            "mensaje_personalizado": "<p>Esto es un test</p>",
            "creador_usuario_ldap": "CONSULTORA_ezense",
            "creacion_fecha": "2024-07-30 11:44:11",
            "estado": "activo",
            "ultimo_usuario_ldap": "CONSULTORA_ezense",
            "ultima_actualizacion": "2024-07-30 11:44:11",
            "titulo_interno": "Notificaci贸n Test",
            "id_Tabla": null,
            "archivos": []
        },
        {
            "id": "63",
            "nombre": "notificaciones_07-30-2024-144411",
            "Desde": "2024-07-30",
            "Hasta": "2024-07-31",
            "Titulo": "Notificaci贸n Test",
            "mensaje_personalizado": "<p>Esto es un test</p>",
            "creador_usuario_ldap": "CONSULTORA_ezense",
            "creacion_fecha": "2024-07-30 11:12:51",
            "estado": "activo",
            "ultimo_usuario_ldap": "CONSULTORA_ezense",
            "ultima_actualizacion": "2024-07-30 11:12:51",
            "titulo_interno": "Notificaci贸n Test",
            "id_Tabla": null,
            "archivos": []
        },
        {
            "id": "62",
            "nombre": "notificaciones_07-30-2024-131748",
            "Desde": "2024-07-30",
            "Hasta": "2024-08-30",
            "Titulo": "Notificaci贸n Importante",
            "mensaje_personalizado": "<p>Hola mi estimado amiguito, ac&aacute; te mostramos lo que es vivir en un pa&iacute;s con infalci&oacute;n.</p><p>PUMBA!!!</p>",
            "creador_usuario_ldap": "CONSULTORA_ezense",
            "creacion_fecha": "2024-07-30 10:15:06",
            "estado": "activo",
            "ultimo_usuario_ldap": "CONSULTORA_ezense",
            "ultima_actualizacion": "2024-07-30 10:15:06",
            "titulo_interno": "Prueba de Notis Jere",
            "id_Tabla": null,
            "archivos": []
        },
        {
            "id": "61",
            "nombre": "notificaciones_05-28-2024-200421",
            "Desde": "2024-05-27",
            "Hasta": "2024-05-31",
            "Titulo": "test66",
            "mensaje_personalizado": "<p>test55</p>",
            "creador_usuario_ldap": "CONSULTORA_ezense",
            "creacion_fecha": "2024-05-28 16:55:19",
            "estado": "activo",
            "ultimo_usuario_ldap": "CONSULTORA_ezense",
            "ultima_actualizacion": "2024-05-28 16:55:19",
            "titulo_interno": "test44",
            "id_Tabla": null,
            "archivos": []
        },
        {
            "id": "60",
            "nombre": "notificaciones_04-29-2024-162230",
            "Desde": "2024-04-29",
            "Hasta": "2024-05-03",
            "Titulo": "test_44",
            "mensaje_personalizado": "<p>test664</p>",
            "creador_usuario_ldap": "CONSULTORA_ezense",
            "creacion_fecha": "2024-04-29 13:21:57",
            "estado": "activo",
            "ultimo_usuario_ldap": "CONSULTORA_ezense",
            "ultima_actualizacion": "2024-04-29 13:21:57",
            "titulo_interno": "test_44",
            "id_Tabla": null,
            "archivos": []
        },
        {
            "id": "59",
            "nombre": "notificaciones_04-29-2024-161738",
            "Desde": "2024-04-29",
            "Hasta": "2024-05-03",
            "Titulo": "ym test 4000000000000",
            "mensaje_personalizado": "<p>gggfdgd00000000000</p>",
            "creador_usuario_ldap": "CONSULTORA_ezense",
            "creacion_fecha": "2024-04-29 13:16:35",
            "estado": "activo",
            "ultimo_usuario_ldap": "CONSULTORA_ezense",
            "ultima_actualizacion": "2025-07-07 16:49:09",
            "titulo_interno": "ym test 4",
            "id_Tabla": null,
            "archivos": []
        },
        {
            "id": "58",
            "nombre": "notificaciones_04-29-2024-155738",
            "Desde": "2024-04-29",
            "Hasta": "2024-05-31",
            "Titulo": "test",
            "mensaje_personalizado": "<p>test ym</p>",
            "creador_usuario_ldap": "CONSULTORA_ezense",
            "creacion_fecha": "2024-04-29 12:56:27",
            "estado": "inactivo",
            "ultimo_usuario_ldap": "CONSULTORA_ezense",
            "ultima_actualizacion": "2024-04-29 13:16:35",
            "titulo_interno": "test ym",
            "id_Tabla": null,
            "archivos": []
        },
        {
            "id": "57",
            "nombre": "notificaciones_03-26-2024-143102",
            "Desde": "2024-03-26",
            "Hasta": "2024-08-31",
            "Titulo": "Notificaci贸n Importante",
            "mensaje_personalizado": "<p>Te informamos que debido al actual contexto inflacionario, nos vemos en la obligaci&oacute;n de aplicar un aumento sobre el precio de los abonos vigentes con el fin de mantener la calidad del servicio brindado. El mismo regir&aacute; a partir de tu pr&oacute;xima facturaci&oacute;n correspondiente a Noviembre de 2023.</p><p>En caso de no aceptar el nuevo precio aplicable a la prestaci&oacute;n del servicio podr&aacute;s solicitar la baja del mismo sin cargo ingresando en iplan.com.ar utilizando el bot&oacute;n de Baja.</p>",
            "creador_usuario_ldap": "CONSULTORA_ezense",
            "creacion_fecha": "2024-03-26 11:28:11",
            "estado": "activo",
            "ultimo_usuario_ldap": "CONSULTORA_ezense",
            "ultima_actualizacion": "2024-03-26 11:28:11",
            "titulo_interno": "Test Biz",
            "id_Tabla": null,
            "archivos": []
        },
        {
            "id": "56",
            "nombre": "notificaciones_12-28-2023-103157",
            "Desde": "2023-12-28",
            "Hasta": "2023-12-31",
            "Titulo": "Notificaci贸n Importante",
            "mensaje_personalizado": "<p>qwweqweqwe</p>",
            "creador_usuario_ldap": "CONSULTORA_ezense",
            "creacion_fecha": "2023-12-28 07:31:46",
            "estado": "inactivo",
            "ultimo_usuario_ldap": "CONSULTORA_ezense",
            "ultima_actualizacion": "2023-12-28 07:35:03",
            "titulo_interno": "Test 1",
            "id_Tabla": null,
            "archivos": []
        },
        {
            "id": "55",
            "nombre": "notificaciones_12-28-2023-102518",
            "Desde": "2023-12-28",
            "Hasta": "2024-01-02",
            "Titulo": "Algo con e帽e y 谩c茅nt贸s",
            "mensaje_personalizado": "<p>testtest test test</p>",
            "creador_usuario_ldap": "CONSULTORA_ezense",
            "creacion_fecha": "2023-12-28 07:23:44",
            "estado": "activo",
            "ultimo_usuario_ldap": "CONSULTORA_ezense",
            "ultima_actualizacion": "2023-12-28 07:23:44",
            "titulo_interno": "Test 31",
            "id_Tabla": null,
            "archivos": []
        },
        {
            "id": "54",
            "nombre": "notificaciones_12-27-2023-170724",
            "Desde": "2023-12-27",
            "Hasta": "2023-12-31",
            "Titulo": "Acci贸n con e帽e",
            "mensaje_personalizado": "<p>a&Ntilde;o a&ntilde;o ca&ntilde;o cami&oacute;n dami&aacute;n quequ&eacute;n.</p>",
            "creador_usuario_ldap": "CONSULTORA_ezense",
            "creacion_fecha": "2023-12-27 14:05:48",
            "estado": "activo",
            "ultimo_usuario_ldap": "CONSULTORA_ezense",
            "ultima_actualizacion": "2023-12-27 14:05:48",
            "titulo_interno": "Acci贸n con e帽e",
            "id_Tabla": null,
            "archivos": []
        },
        {
            "id": "53",
            "nombre": "notificaciones_12-27-2023-165633",
            "Desde": "2023-12-27",
            "Hasta": "2023-12-31",
            "Titulo": "acci贸n r谩pida con acentos",
            "mensaje_personalizado": "<p>testtesttest</p>",
            "creador_usuario_ldap": "CONSULTORA_ezense",
            "creacion_fecha": "2023-12-27 13:51:53",
            "estado": "inactivo",
            "ultimo_usuario_ldap": "CONSULTORA_ezense",
            "ultima_actualizacion": "2023-12-27 14:05:48",
            "titulo_interno": "acci贸n r谩pida con acentos",
            "id_Tabla": null,
            "archivos": []
        },
        {
            "id": "52",
            "nombre": "notificaciones_12-22-2023-205828",
            "Desde": "2023-12-22",
            "Hasta": "2024-08-18",
            "Titulo": "Notificaci贸n importante",
            "mensaje_personalizado": "<p>Te informamos que debido al actual contexto inflacionario, nos vemos en la obligaci&oacute;n de aplicar un aumento sobre el precio de los abonos vigentes con el fin de mantener la calidad del servicio brindado. El mismo regir&aacute; a partir de tu pr&oacute;xima facturaci&oacute;n correspondiente a <strong>Noviembre de 2023</strong>.</p><p>En caso de no aceptar el nuevo precio aplicable a la prestaci&oacute;n del servicio podr&aacute;s solicitar la baja del mismo sin cargo ingresando en iplan.com.ar utilizando el bot&oacute;n de Baja.</p>",
            "creador_usuario_ldap": "jcalvo",
            "creacion_fecha": "2023-12-22 17:56:15",
            "estado": "activo",
            "ultimo_usuario_ldap": "jcalvo",
            "ultima_actualizacion": "2023-12-22 17:56:15",
            "titulo_interno": "Aumento IPLAN liv | Vigencia Noviembre 2023",
            "id_Tabla": null,
            "archivos": []
        },
        {
            "id": "51",
            "nombre": "notificaciones_12-22-2023-132414",
            "Desde": "2023-12-29",
            "Hasta": "2024-02-29",
            "Titulo": "Aumentossssss",
            "mensaje_personalizado": "<p>lalalalalala abuelaaaaaaa</p>",
            "creador_usuario_ldap": "jcalvo",
            "creacion_fecha": "2023-12-22 10:23:34",
            "estado": "activo",
            "ultimo_usuario_ldap": "CONSULTORA_ezense",
            "ultima_actualizacion": "2025-07-14 12:32:29",
            "titulo_interno": "Prueba 22/12/23",
            "id_Tabla": null,
            "archivos": []
        },
        {
            "id": "50",
            "nombre": "notificaciones_12-21-2023-205318",
            "Desde": "2023-12-21",
            "Hasta": "2024-05-21",
            "Titulo": "Aumento de preciosss",
            "mensaje_personalizado": "<p>Te informamos que debido al actual contexto inflacionario, nos vemos en la obligaci&oacute;n de aplicar un aumento sobre el precio de los abonos vigentes con el fin de mantener la calidad del servicio brindado. El mismo regir&aacute; a partir de tu pr&oacute;xima facturaci&oacute;n correspondiente a&nbsp;<strong>Enero de 2024</strong>.</p><p>En caso de no aceptar el nuevo precio aplicable a la prestaci&oacute;n del servicio podr&aacute;s solicitar la baja del mismo sin cargo ingresando en&nbsp;<a href=\"https://iplan.com.ar/zona-de-clientes-2020#bajas\" target=\"_blank\" rel=\"noopener nofollow noreferrer\">iplan.com.ar</a> utilizando el bot&oacute;n de Baja.</p>",
            "creador_usuario_ldap": "jcalvo",
            "creacion_fecha": "2023-12-21 17:47:26",
            "estado": "activo",
            "ultimo_usuario_ldap": "CONSULTORA_ezense",
            "ultima_actualizacion": "2025-07-14 12:32:09",
            "titulo_interno": "Aumento de test 21/12/23 #2",
            "id_Tabla": null,
            "archivos": []
        },
        {
            "id": "49",
            "nombre": "notificaciones_12-21-2023-171901",
            "Desde": "2023-12-21",
            "Hasta": "2024-02-21",
            "Titulo": "Aumento Febrero Test #1",
            "mensaje_personalizado": "<p style=\"text-align: center;\"><strong>Mensaje personalizado de prueba en negrita y centrado</strong></p><p style=\"text-align: left;\">Mensaje personalizado de prueba alineado a izquierda</p><p style=\"text-align: right;\">Mensaje personalizado de prueba alineado a derecha</p><p style=\"text-align: center;\">Mensaje de prueba centrado</p>",
            "creador_usuario_ldap": "jcalvo",
            "creacion_fecha": "2023-12-21 14:13:27",
            "estado": "inactivo",
            "ultimo_usuario_ldap": "jcalvo",
            "ultima_actualizacion": "2023-12-22 10:23:34",
            "titulo_interno": "Prueba de Juancho 21/12/23 Test #1",
            "id_Tabla": null,
            "archivos": []
        },
        {
            "id": "48",
            "nombre": "notificaciones_12-05-2023-141550",
            "Desde": "2023-12-05",
            "Hasta": "2024-01-05",
            "Titulo": "Aumento de Prueba",
            "mensaje_personalizado": "<p style=\"text-align: center;\">Te informamos que debido al actual contexto inflacionario, nos vemos en la obligaci&oacute;n de aplicar un aumento sobre el precio de los abonos vigentes con el fin de mantener la calidad del servicio brindado. El mismo regir&aacute; a partir de tu pr&oacute;xima facturaci&oacute;n correspondiente.<br>En caso de no aceptar el nuevo precio aplicable a la prestaci&oacute;n del servicio podr&aacute;s solicitar la baja del mismo sin cargo ingresando en iplan.com.ar utilizando el bot&oacute;n de Baja.</p>",
            "creador_usuario_ldap": "jcalvo",
            "creacion_fecha": "2023-12-05 11:14:25",
            "estado": "inactivo",
            "ultimo_usuario_ldap": "CONSULTORA_ezense",
            "ultima_actualizacion": "2023-12-21 16:44:00",
            "titulo_interno": "Test Juancho/Marce",
            "id_Tabla": null,
            "archivos": []
        },
        {
            "id": "47",
            "nombre": "notificaciones_12-05-2023-141252",
            "Desde": "2023-12-05",
            "Hasta": "2024-01-05",
            "Titulo": "Titulo Juancho",
            "mensaje_personalizado": "<p style=\"text-align: center;\">Mensaje de<strong> aumento de octubre </strong>2023</p><p style=\"text-align: center;\">Prueba de juancho... Abajo hay un bot&oacute;n</p>",
            "creador_usuario_ldap": "jcalvo",
            "creacion_fecha": "2023-12-05 11:03:38",
            "estado": "inactivo",
            "ultimo_usuario_ldap": "jcalvo",
            "ultima_actualizacion": "2023-12-21 14:05:58",
            "titulo_interno": "Octubre 2023 Liv",
            "id_Tabla": null,
            "archivos": []
        },
        {
            "id": "46",
            "nombre": "notificaciones_12-04-2023-195500",
            "Desde": "2023-12-04",
            "Hasta": "2024-02-04",
            "Titulo": "Aumento de Precios",
            "mensaje_personalizado": "<p style=\"text-align: center;\">Texto personalizado para el <strong>aumento 3</strong> cargado por juancho.</p><p style=\"text-align: center;\">Los precios est&aacute;n mas abajo...</p><p style=\"text-align: center;\">Los precios est&aacute;n mas abajo...</p><p style=\"text-align: center;\">Los precios est&aacute;n mas abajo...</p><p style=\"text-align: center;\">Los precios est&aacute;n mas abajo...</p>",
            "creador_usuario_ldap": "jcalvo",
            "creacion_fecha": "2023-12-04 16:42:47",
            "estado": "inactivo",
            "ultimo_usuario_ldap": "jcalvo",
            "ultima_actualizacion": "2023-12-21 14:05:55",
            "titulo_interno": "Test Juancho 3 - 4/!2/23",
            "id_Tabla": null,
            "archivos": []
        },
        {
            "id": "45",
            "nombre": "notificaciones_12-04-2023-194247",
            "Desde": "2023-12-04",
            "Hasta": "2024-01-04",
            "Titulo": "Aumento 2",
            "mensaje_personalizado": "<p style=\"text-align: center;\">Este es el aumento <strong>n&uacute;mero 2</strong> cargado por juancho desde la nueva herramienta.</p><p style=\"text-align: center;\">Si quer&eacute;s ver los <em>precios</em> hac&eacute; click abajo...</p>",
            "creador_usuario_ldap": "jcalvo",
            "creacion_fecha": "2023-12-04 16:40:53",
            "estado": "inactivo",
            "ultimo_usuario_ldap": "jcalvo",
            "ultima_actualizacion": "2023-12-05 12:05:18",
            "titulo_interno": "Test Juancho 2 - 4/12/23",
            "id_Tabla": null,
            "archivos": []
        },
        {
            "id": "44",
            "nombre": "notificaciones_12-04-2023-194053",
            "Desde": "2023-12-05",
            "Hasta": "2024-01-05",
            "Titulo": "Aumento 1",
            "mensaje_personalizado": "<p>Aumento <strong>n&uacute;mero 1 </strong>cargado por juancho desde la nueva herramienta.</p><p>Si quer&eacute;s saber los precios hace click abajo&nbsp;</p>",
            "creador_usuario_ldap": "jcalvo",
            "creacion_fecha": "2023-12-04 16:38:25",
            "estado": "inactivo",
            "ultimo_usuario_ldap": "jcalvo",
            "ultima_actualizacion": "2023-12-05 12:04:45",
            "titulo_interno": "Juancho 1 - 4/12/23",
            "id_Tabla": null,
            "archivos": []
        },
        {
            "id": "43",
            "nombre": "notificaciones_12-01-2023-200404",
            "Desde": "2023-11-30",
            "Hasta": "2024-12-01",
            "Titulo": "Aumento de precios",
            "mensaje_personalizado": "<p>Este es el mensaje para el cliente cargado en la <strong>prueba n&uacute;mero 1 </strong>de la nueva web de notificaiones.</p><p>Este es el mensaje para el cliente cargado en la <strong>prueba n&uacute;mero 1 </strong>de la nueva web de notificaiones.</p>",
            "creador_usuario_ldap": "jcalvo",
            "creacion_fecha": "2023-12-01 16:57:14",
            "estado": "inactivo",
            "ultimo_usuario_ldap": "jcalvo",
            "ultima_actualizacion": "2023-12-04 16:38:25",
            "titulo_interno": "Aumento de prueba numero 1",
            "id_Tabla": null,
            "archivos": []
        }
    ];

    dispatch(starLoadingNotificaciones(true));
    let config = {
